Title,Content,Number of Words,Category,SubCategory
Controversial 'Gender Queer' tops library group's list of challenged books,"Fight for Schools executive director Ian Prior says schools focus too much on social issues over academics and parents should have more transparency in their children’s education. The book ""Gender Queer"" topped a library group’s list of challenged books. According to the American Library Association, ""Gender Queer: A Memoir,"" by Maia Kobabe, was the No. 1 title on the most challenged books in 2022 for the second year in a row. The book has been challenged for LGBTQIA+ and sexually explicit content. Each year, the ALA's Office for Intellectual Freedom (OIF) creates a list of the Top 10 Most Challenged Books to keep the public informed about censorship in libraries and schools. 'GENDER QUEER' AUTHOR DOUBLES DOWN ON EXTREMELY GRAPHIC IMAGES OF SEX ACTS, SAYS IT COULD HAVE BEEN WORSE ""The lists are based on information from reports filed by library professionals and community members and from news stories published throughout the United States,"" the ALA says on its website. Books  (iStock) ""Gender Queer"" has courted major controversy among America’s parents for being in public school libraries throughout the U.S. and has been challenged for its depictions and descriptions of oral sex, as well as discussions on masturbation. CALIFORNIA DAD SAYS 8-YEAR-OLD DAUGHTER 'FORCED' TO LEARN ABOUT BEING TRANSGENDER: 'OUT OF LEFT FIELD' The book also discusses Kobabe's journey of self-discovery towards identifying outside the ""gender binary."" Fox News Digital previously reported on the book’s author Kobabe defending the sexually explicit graphic images in the memoir during an interview with NPR. Photo full library shelves after Governor DeSantis signed into law re-evaluating the books allowed in Florida Schools. The photo was posted in contrast to the one posted by fired substitute teacher Brian Covey. (Duval County Public Schools) Furthermore, a newly released report revealed that nearly 1,500 books were banned in the first half of the 2022-2023 school year. According to PEN America’s Index of School Book Bans lists, there were 1,477 instances of individual books banned during the first half of the 2022-23 school year. KENTUCKY DISTRICT OFFICIAL INVOKES ADOLF HITLER IN DEFENSE OF 'PORNOGRAPHY' BOOK CHALLENGED BY MOM PEN America recorded more book bans during the fall 2022 semester than in each of the prior two semesters. PEN America also reports that 30% of the ""unique titles"" banned are books about race, racism, or feature characters of color. They also note that 26% of unique titles banned have LGBTQ+ characters or themes. PEN America claimed that they have tracked book-banning efforts for the past two years by documenting the growth of groups advocating for book bans, the widespread challenges to books across the nation, efforts on the local level such as school district policies and procedures, and the state-level policies. Maia Kobabe, the author of ""Gender Queer,"" one of the most banned books in America. (Maia Kebab | YouTube/Screenshot) The book ban issue has been prevalent in red states such as Texas, Florida, Missouri, Utah, and South Carolina, where local school boards took up the issue. CLICK HERE TO GET THE FOX NEWS APP Joshua Q. Nelson is a reporter for Fox News Digital. Joshua focuses on politics, education policy ranging from the local to the federal level, and the parental uprising in education. Joining Fox News Digital in 2019, he previously graduated from Syracuse University with a degree in Political Science and is an alum of the National Journalism Center and the Heritage Foundation's Young Leaders Program. Story tips can be sent to joshua.nelson@fox.com and Joshua can be followed on Twitter and LinkedIn. ",586,ENTERTAINMENT,
Trump cheers CNN's firing of 'dumbest man on television' Don Lemon: 'What took them so long?',"The network announced it parted ways with the longtime host on Monday. Former President Donald Trump on Monday celebrated the firing of Don Lemon by liberal news network CNN, a culmination of the tumultuous relationship between the two over the years. ""Good News: ‘The dumbest man on television,’ Don Lemon, has finally been fired from Fake News CNN. My only question is, WHAT TOOK THEM SO LONG?"" Trump wrote on Truth Social after news of Lemon's termination broke. CNN announced earlier in the day that it had parted ways with Lemon, who claimed he was informed by his agent rather than the management at the liberal network. CNN FIRES DON LEMON, LEAVING LONGTIME ANCHOR ‘STUNNED’ Former President Donald Trump celebrated the firing of CNN's Don Lemon in a post on Truth Social on Monday, April 24, 2023. (Screenshot/Truth Social) Lemon had faced increased scrutiny in recent months following his controversial comments in February that 51-year-old GOP presidential candidate and former U.N. Ambassador Nikki Haley, was past her ""prime"" as she advocated for politicians over 75 to take a mandatory cognitive test. He was forced to undergo ""training"" following the comments, according to CNN, and apologized to the network's staff in a morning editorial call. He was also scolded by CNN president Chris Licht during the call. Trump's reference to Lemon as ""the dumbest man on television,"" was just the latest in an off-and-on feud between the two that included numerous clashes over the years. NIKKI HALEY TAUNTS CNN'S DON LEMON OVER FIRING: ‘A GREAT DAY FOR WOMEN EVERYWHERE’ Republican presidential candidate and former U.N. Ambassador Nikki Haley taking the stage at CPAC 2023. (Getty) Trump originally coined the nickname for Lemon in 2017, referencing a previous instance he referred to the former host by the same name. ""I seldom, if ever, watch CNN or MSNBC, both of which I consider Fake News. I never watch Don Lemon, who I once called the 'dumbest man on television!'"" he wrote on Twitter, referencing a report by The New York Times that he watched hours of television a day. In 2020, Trump called Lemon ""not a smart person"" following a segment where the former host mocked the former president and his supporters. ""So I watched this guy, he's a terrible ... he's not a smart person, at all. But I watch that phony laugh. That wasn't a laugh. He was trying to act, puts his head down, always laughing so hard,"" Trump told Fox News' Sean Hannity as part of an exclusive interview at the time. ""There's nothing funny about what was said."" BIDEN'S 2024 CHALLENGERS USE DEMOCRATS' ‘DEMOCRACY’ SLOGAN AGAINST THEM, SAY PRIMARY IS ‘RIGGED’ Last October, Lemon claimed Trump ""didn't have the courage"" to come on CNN and answer his questions, and claimed he and the audience were ready to ""move on"" from the presence of Trump in political discussions. Former United States President Donald Trump stands on the floor during the Division I Men's Wrestling Championship held at the BOK Center on March 18, 2023, in Tulsa, Oklahoma. (Photo by Shane Bevel/NCAA Photos via Getty Images) Don Lemon attends the Pre-GRAMMY Gala & GRAMMY Salute To Industry Icons Honoring Julie Greenwald & Craig Kallman at The Beverly Hilton on February 04, 2023, in Beverly Hills, California. (Photo by Jeff Kravitz/FilmMagic) (Shane Bevel/Jeff Kravitz) In June 2021, Lemon urged the media to leave Trump alone and stop covering him but proceeded launch more rants against the former president, calling him the ""disgraced"" former president just hours after making the plea. More than two weeks later, every installment of Lemon's then-show, ""Don Lemon Tonight,"" opened with the former anchor attacking Trump, whether in his monologue or during his hand-off with his then-primetime colleague Chris Cuomo. CLICK HERE TO GET THE FOX NEWS APP Fox News' Joseph A. Wulfsohn contributed to this report. Brandon Gillespie is an associate editor at Fox News. Follow him on Twitter at @brandon_cg. ",655,POLITICS,politics
Second Anheuser-Busch marketing executive on leave following Dylan Mulvaney controversy,"Bud Light VP Alissa Heinerscheid spoke on a podcast, where she expressed disdain for how Bud Light has been perceived in the past. A second Anheuser-Busch marketing executive has taken a leave of absence in the wake of the controversy surrounding its partnership with transgender influencer Dylan Mulvaney. Daniel Blake, who oversees marketing for Anheuser-Busch’s mainstream brands, is also being placed on leave. Over the weekend, news broke that Bud Light‘s marketing VP, Alissa Heinerscheid, had taken a leave of absence amid the backlash to the Mulvaney fallout and a widespread boycott from Bud Light drinkers. Bud Light VP Alissa Heinerscheid explains how she brought her personal values to the Bud Light brand. (Make Yourself at Home podcast) Todd Allen, most recently global vice president of Budweiser, is slated to take over Heinerscheid’s role, but the company has not announced a replacement for Blake. FORMER BUD LIGHT DRINKERS SAY ‘TOO LITTLE, TOO LATE’ AFTER BRAND TRIES OT MAKE AMENDS WITH PRO-AMERICA AD ""Given the circumstances, Alissa has decided to take a leave of absence which we support. Daniel has also decided to take a leave of absence,"" Anheuser-Busch told the WSJ. Mulvaney was announced as a Bud Light spokesperson to promote the March Madness basketball tournament this month, which has prompted ridicule and backlash from the media and the public in recent weeks. The trans activist showed off cans of Bud Light sent by Anheuser-Busch that featured Mulvaney's face, celebrating a milestone in her viral ""365 Days of Girlhood"" series where the influencer detailing her daily experiences in her first year identifying as a transgender woman on TikTok. Some people in Nashville said they stopped drinking Bud Light after the brand partnered with trans influencer Dylan Mulvaney.  (Instagram) Heinerscheid was ridiculed after a March 30 interview surfaced where she aired her thoughts on the beer brand, explaining that what she ""brought"" to the brand was a ""belief"" that to evolve and elevate means to incorporate ""inclusivity, it means shifting the tone, it means having a campaign that’s truly inclusive, and feels lighter and brighter and different, and appeals to women and to men."" 'THE VIEW' CO-HOST WHOOPI GOLDBERG FLIPS OUT OVER BUD LIGHT BOYCOTTS: 'IT'S JUST BEER' Heinerscheid suggested that ""representation is sort of at the heart of evolution, you have got to see people who reflect you in the work."" ""We had this hangover, I mean Bud Light had been kind of a brand of fratty, kind of out of touch humor, and it was really important that we had another approach,"" she said. Dylan Mulvaney has partnered with numerous brands in recent months.  (Photo by Cindy Ord/Getty Images) ""I’m a businesswoman, I had a really clear job to do when I took over Bud Light, and it was ‘This brand is in decline, it’s been in a decline for a really long time, and if we do not attract young drinkers to come and drink this brand there will be no future for Bud Light,'"" Heinerscheid said. BUD LIGHT'S PACT WITH TRANS ACTIVIST DYLAN MULVANEY SPARKS OUTRAGE, PRAISE Mulvaney has partnered with a number of prominent brands and was rumored to have a relationship with Tampax, posting to TikTok in 2022 about a proposed partnership. ""When Tampax offers to sponsor you but you don’t have a [cat emoji],"" Mulvaney shared at the time. CLICK HERE TO GET THE FOX NEWS APP Nike received backlash last week after Mulvaney appeared in paid social media content dancing in Nike women's sports bras. The brand doubled down on its decision to feature Mulvaney as a paid ambassador to promote the company's female clothing, telling customers to, ""Be kind, be inclusive … Encourage each other."" Kendall Tietz is a Production Assistant with Fox News Digital. ",623,ENTERTAINMENT,
Democrats rip DNC for not holding 2024 primary debates: 'Robs the voters',"2024 presidential candidate Robert F. Kennedy Jr. joined ‘Cavuto Live’ to discuss his forthcoming campaign, detailing his major political points on challenging President Biden. Democratic presidential candidate Marianne Williamson and others criticized a lack of Democratic primary debates as ""undemocratic"" and ""unfortunate"" as President Biden is preparing to announce his re-election bid. ""The DNC ‘plans no primary debates.’ As though there simply ARE no other candidates … no other ideas we should discuss about ways to win in 2024, or other ideas we should discuss about ways to repair the country. Too many people are too smart to accept this,"" Williamson said. Nina Turner, a former Ohio state senator and co-chair of Bernie Sanders' 2020 presidential campaign, said the DNC's decision was ""undemocratic"" and that it ""robs voters of choice."" In 2020, the RNC also did not sponsor any primary debates between then-President Trump and his challengers. Several candidates sought the nomination, including former GOP congressman Joe Walsh and former Massachusetts Gov. Bill Weld, but none of them were considered remotely serious threats to Trump. Self-help author Marianne Williamson speaks to the crowd as she launches her 2024 presidential campaign in Washington, Saturday, March 4, 2023. (AP Photo/Jose Luis Magana) HUGE MAJORITY OF AMERICANS OPPOSE BIDEN RUNNING AGAIN, CITING ONE ‘MAJOR’ FACTOR: POLL ""It’s simple — I believe in democracy, therefore I believe in debates. The DNC, RNC, and every third party should hold that same belief in a democracy. This isn’t a radical idea,"" Turner said in another tweet on Monday. Robert F. Kennedy Jr. recently announced that he would also be challenging Biden in the Democratic primary. ""I've come here today to announce my candidacy for Democratic nomination for President of the United States,"" Kennedy said at a hotel in Boston. ""My mission over the next 18 months of this campaign, and throughout my presidency, will be to end the corrupt merger of state and corporate power that is threatening now to impose a new kind of corporate feudalism on our country."" He criticized the DNC's decision to not sponsor any debates during a podcast appearance on Sunday, saying it was ""unfortunate."" BOSTON, MA - APRIL 19: Robert F. Kennedy Jr. is joined by family and supporters on stage after announcing his candidacy for President on April 19, 2023 in Boston, Massachusetts. An outspoken anti-vaccine activist, RFK Jr. joins self-help author Marianne Williamson in the Democratic presidential field of challengers for 2024.  (Scott Eisen/Getty Images) ROBERT KENNEDY JR. CALLS OUT BIDEN WITH 2024 WHITE HOUSE BID: I'M IN ‘MUCH BETTER POSITION’ TO BEAT TRUMP ""The DNC, at this point, has taken the official position that there will be no debate, and I think that’s unfortunate,"" he told Breitbart's Joel Pollak. He also criticized the DNC's decision to alter the top of its presidential nominating calendar for the 2024 election cycle by voting to bump Iowa and New Hampshire from their leadoff positions. U.S. President Joe Biden speaks during a rally hosted by the Democratic National Committee (DNC) at Richard Montgomery High School on August 25, 2022 in Rockville, Maryland. (Drew Angerer/Getty Images) CLICK HERE TO GET THE FOX NEWS APP Biden is preparing to announce his re-election campaign on April 25, the four-year anniversary of his 2020 campaign launch, via video. None of the announced candidates are considered major threats to him getting the nomination again. Biden survived a gigantic field in 2020 that included now-Vice President Kamala Harris, current Transportation Secretary Pete Buttigieg, Sen. Elizabeth Warren, D-Mass., Sen. Bernie Sanders, I-Vt., and former New York City mayor Michael Bloomberg, D. Republicans are set to hold their first presidential primary debate in Milwaukee in August. Hanna Panreck is an associate editor at Fox News. ",616,ENTERTAINMENT,
Americans spending up to $85k to bulletproof cars as crime surges: 'Uncertainty... has become a major concern',"Founder and CEO of Armormax Mark Burton discusses the demand for bulletproof cars among surging crime in liberal cities. As crime takes hold of U.S. cities, Americans are taking drastic measures to protect themselves and their families by spending tens of thousands of dollars to bulletproof their cars. Founder and CEO of Armormax Mark Burton explained how his clientele has evolved from the world's most wealthy to everyday Americans in recent years during ""Fox & Friends. ""Ten years ago, it was the richest of the rich that were mainly concerned about their business,"" Burton told Todd Piro Monday, ""Today, that's gone down the economic pyramid. You have doctors, you have lawyers, you have real estate agents, you have developers, you have the… average Joe, I can say, that are spending some money to protect themselves in their vehicles."" ONE OUT OF EVERY 179 AMERICANS WILL EVENTUALLY BE MURDERED IF CRIME RATE CONTINUES, STUDY FINDS On the high end, Americans are spending up to $85,000 to have their car completely bulletproofed. The price tag, which Burton explained depends on the model of the vehicle, can also be tailored accordingly if a client wants just portions of the car bulletproofed to include certain windows and/or doors. Some Americans are getting their cars bulletproofed for a 'peace of mind' amid surging crime, founder of Armormax Mark Burton says ""They're looking for peace of mind,"" Burton said. ""It's almost like an insurance policy. They hope they never have to use it. But… if those experiences occur, or those incidences occur, then they're safe."" Burton noted the evolving clientele has happened over the course of the last year and a half, noting surging violence in major cities as a driving force for the shift. MASSIVE INCREASE IN BLACK AMERICANS MURDERED WAS RESULT OF DEFUND POLICE MOVEMENT: EXPERTS ""The change started occurring about 18 months ago,"" Burton said. ""At the time we were doing about 85% of our business here in the United States for overseas customers, and now that has completely flipped. The uncertainty that exists in the United States today, and in particular in some of the larger cities, has increased that demand."" New Orleans closed out 2022 with a decades-high homicide record and unseated St. Louis as America’s ""Murder Capital."" It recorded 52 homicides per 100,000 residents. St. Louis, which has long been ranked and considered one of the country’s most dangerous cities, had 45 homicides per 100,000 residents that same month. Crime in New York City also made headlines in 2022, despite a decline in murders and shootings. As those violent crimes fell, robberies, burglaries, felony assault, grand larceny and other crimes continued in the city, spurring major crimes to increase by 22% compared to 2021. CLICK HERE TO GET THE FOX NEWS APP Overall homicides in large U.S. cities were down about 5% in 2022 compared to 2021, when murders in large cities hit a 25-year high. ""We have the West Coast. We have Los Angeles area. We have New Orleans. We have Miami. You mentioned Chicago and New York… those are two of our biggest markets,"" Burton said. ""We get calls, multiple calls, and we get multiple sales every week from those two principal areas. But it's the larger metropolis type of areas where the crime has increased tremendously."" ""The uncertainty, being at the wrong place at the wrong time, has become a major concern,"" he continued. Fox News' Emma Colton, Audrey Conklin and Jasmine Baehr contributed to this report. Bailee Hill is an associate editor with Fox News Digital. Story ideas can be sent to bailee.hill@fox.com ",597,ENTERTAINMENT,
Miranda Devine calls for intel officials to lose security clearances over false claims about Hunter laptop,"New York Post columnist Miranda Devine discusses the expected meeting between Hunter Biden's attorneys and Justice Department officials. New York Post columnist Miranda Devine called for security clearances to be stripped from all 51 former intelligence officials who signed a letter in 2020 claiming the stories about Hunter Biden's laptop were Russian disinformation. On ""America's Newsroom"" Monday, Devine accused the intel officials of abusing their authority and said Biden used the letter as a ""get out of jail free card"" in his final presidential debate against Donald Trump. REPUBLICANS RESPOND AFTER IRS WHISTLEBLOWER SAYS HUNTER BIDEN INVESTIGATION IS BEING MISHANDLED MIRANDA DEVINE: It's just bombshell on top of bombshell. And you're right. The revelation that the Biden campaign – specifically now-Secretary of State Antony Blinken, when he was a campaign senior adviser – reached out to a high-ranking former acting director of the CIA and got him to organize this letter, claiming falsely that the stories we published from the laptop were Russian disinformation. Those 51 former intelligence officials are really at fault. … And they should have their security clearances stripped. They abused their former higher authority. They did not do any due diligence. They peppered the end of the letter with weasel words so that they could have plausible deniability now, but it doesn't wash. They saw how that letter was handled by the media as they intended, by calling it Russian disinformation, reducing our reporting, and they never spoke up. John Brennan and the rest of them fanned out across the left- wing media and kept on saying drumbeat after drumbeat, ‘This is straight from the Kremlin.’ And of course, a couple of days later, Joe Biden used that letter to get out of jail free effectively at the last debate against Donald Trump. Very effectively. It worked. Secretary of State Antony Blinken and Hunter Biden (Getty Images) A former CIA official testified that then-Biden campaign senior adviser, now-Secretary of State Antony Blinken ""played a role in the inception"" of the public statement signed by current and past intelligence officials that claimed the Hunter Biden laptop was part of a Russian disinformation campaign. Former CIA Deputy Director Michael Morrell testified before the House Judiciary and Intelligence Committees, and revealed that Blinken was ""the impetus"" of the public statement signed in October 2020 that implied the laptop belonging to Hunter Biden was disinformation. House Judiciary Committee Chairman Jim Jordan, R-Ohio, and House Intelligence Committee Chairman Mike Turner, R-Ohio, sent a letter to Blinken Thursday, notifying him that the panels are ""conducting oversight of federal law-enforcement and intelligence matters within our respective jurisdictions."" In October 2020, weeks before the presidential election, dozens of ex-national security officials signed onto a letter claiming that Hunter's laptop had ""all the classic earmarks of a Russian information operation."" The former officials included former Obama CIA Director John Brennan, former Obama DNI James Clapper, and former CIA director, then-Defense Secretary Leon Panetta, among others. Fox News' Brooke Singman contributed to this report. ",498,ENTERTAINMENT,
