Title,Content,Number of Words,Category,SubCategory
Bill Maher hands out 'Cojones Awards' to those who fought against cancel culture mob,"The actress slammed cancel culture on Wednesday, saying she is 'concerned' about the growing trend of culture wars. ""Real Time"" host Bill Maher unveiled a new ""award show"" on the caliber of the Oscars and the Emmys dedicated to honoring those who were brave enough to stand up against the cancel culture mob, something he vowed to do every year going forward. Maher began his closing monologue on Friday by revealing he along with other A-listers were invited to the home of ""a very prominent Hollywood producer"" where he was asked to moderate a discussion about cancel culture. ""That was the point of the evening - how do we take a stand against cancel culture? And I suggested since we were mostly all in show business that we start at an award show to honor the brave people who have fought back,"" Maher said. ""The idea was met with great enthusiasm by everyone and in short order, different people were suggesting the ways that they're very challenged to be put to use. And then of course being Hollywood, nothing happened. But it's still a good idea, so I'm going to do it right here, right now."" BILL MAHER INVOKES CLINTON IN WARNING TO DEMS ABOUT TRUMP INDICTMENT: ‘SEX SCANDALS DON’T WORK ON PRESIDENTS' Dubbed the ""Cojones Awards,"" the new award show honored ""outstanding achievement in growing a pair"" and each recipient received a golden statue of dangling testicles, which Maher referred to as ""solid brass balls."" ""Real Time"" host Bill Maher presented the ""Cojones Awards"" dedicated to those who fought back against cancel culture. (HBO) The first award went to his alma mater Cornell University and its president Martha Pollack, who rejected students' demand for trigger warnings to be included in their courses. ""She didn't cave in or hire a new dean of sensitivity, she just said, ""No. College is for introducing you to new ideas, not for kissing your ass and making you feel wonderful and always right,'"" Maher told his audience. WARNING: EXPLICIT LANGUAGE BILL MAHER FEARS TRUMP INDICTMENT WILL SPARK ‘CYCLE OF REVENGE’ FOR FUTURE PRESIDENTS The second award went to Trader Joe's, which stood behind its food products' ethnically-themed names like ""Trader José's,"" ""Trader Ming's"" and ""Arabian Joe's"" after a petition called for their removal for being ""racist."" The grocery store chain issued a statement at the time saying inpart, ""We disagree that any of these labels are racist and we do not make decisions based on petitions."" ""You see how easy it is? So, to the home of the 19-cent banana, here, have some nuts,"" Maher said while holding the golden balls trophy. Trader Joe's received its ""Cojones Award"" for rejecting a petition to remove the name of its ethnic food products deemed racist by the cancel culture mob. (Jeffrey Greenberg/Universal Images Group via Getty Images) The third recipient was Netflix CEO Ted Sarandos for his handling of the employee uproar towards Dave Chappelle's comedy special, telling staffers if they don't support the content then ""Netflix may not be the best place for you."" ""So for making the phrase 'don't let the door hit you in the ass' never sound better, this is for you Ted,"" Maher told the Netflix boss. BILL MAHER WARNS CHARGING TRUMP OVER HUSH MONEY PROBE WOULD BE ‘COLOSSAL MISTAKE’: ‘ROCKET FUEL’ FOR 2024 Bill Maher gave a ""Cojones"" trophy to Netflix CEO Ted Sarandos for standing up against his staffers protesting the Dave Chappelle comedy special.  (Photo by Eamonn M. McCormack/Getty Images  |  Photo by Eamonn M. McCormack/Getty Images for BFI) CLICK HERE FOR THE FOX NEWS APP The final honoree was Ben Stiller, who earlier this year defended his 2008 film ""Tropic Thunder"" saying he makes ""no apologies"" for the edgy comedy and that he's ""proud"" of his work and everyone involved. ""And the lesson is if you stand up to the mob for just a day or two, their shallow, impatient, immature smartphone-driven gerbil minds will forget about it and go on to the next nothingburger and you, you still will have your cojones,"" Maher concluded. Joseph A. Wulfsohn is a media reporter for Fox News Digital. Story tips can be sent to joseph.wulfsohn@fox.com and on Twitter: @JosephWulfsohn. ",700,ENTERTAINMENT,
CNN anchor asks if US wants ‘4 more years’ of Biden when 74% of Americans say US headed in ‘wrong direction',"CNN host John King warned that Biden remains dogged by many serious issues as well as a general widespread concern about the trajectory of the country. CNN anchor John King noted President Biden’s key challenges, and asked whether the American public truly plans to reelect him in 2024. While the political pushback many expected for Democrats in the Midterm elections never materialized, some are questioning whether President Joe Biden himself can still win a national election. A recent poll from The Associated Press-NORC Center for Public Affairs Research found that 52% of Democrats do not want Biden to run for the presidency in 2024. King spoke on his show ""Inside Politics"" about the issues undermining Biden’s re-electability. King noted that Biden ""clearly has liabilities"" and said, ""he’s 80 years old. He will be 82 on Inauguration Day 2025."" CNN host John King speaks about Biden's potential chances of being reelected in 2024. BIDEN TO OFFICIALLY ANNOUNCE RE-ELECTION BID NEXT WEEK: REPORTS ""Do the American people want that?"" he asked. ""Do they want four more years for this president?"" King then spoke about various political issues that have dogged Biden's presidency. ""Immigration is an issue where the Biden Administration, the numbers are not working in his favor, and the Republicans plan to make a very big deal of that,"" he said. ""Inflation and recession fears, obviously, issue number one. Where is the economy six months from now and nine months from now compared to today? This is a tough challenge if you’re an incumbent president."" President Biden during his February 2023 State of the Union address. (Nathan Howard/Bloomberg via Getty Images) WHITE HOUSE INSISTS NO 'POLITICAL INTERFERENCE' IN HUNTER BIDEN PROBE AFTER IRS WHISTLEBLOWER COMES FORWARD He then noted a poll with grim implications for Biden’s electoral chances. ""Look at this number. Nearly three quarters of Americans say the country is going in the wrong direction. Joe Biden is asking for four more years,"" he said. ""When 74 percent of Americans think the country is heading the wrong way it’s hard for the boss to say 'give me four more years.' This is a giant challenge for the president."" PHILADELPHIA, PENNSYLVANIA - SEPTEMBER 01: U.S. President Joe Biden delivers a primetime speech at Independence National Historical Park September 1, 2022 in Philadelphia, Pennsylvania. President Biden spoke on ""the continued battle for the Soul of the Nation.""  (Photo by Alex Wong/Getty Images) ( Alex Wong/Getty Images) CLICK HERE TO DOWNLOAD THE FOX NEWS APP President Biden is reportedly expected to announce his bid for a second term as president next week. Alexander Hall is an associate editor for Fox News Digital. Story tips can be sent to Alexander.hall@fox.com. ",446,ENTERTAINMENT,
Parents reportedly suing school district after it allegedly helped secretly transition their child,"Montana Rep. Zooey Zephyr said when debating SB99, ""If you vote yes on this bill and yes on these amendments I hope the next time there’s an invocation when you bow your heads in prayer, you see the blood on your hands."" A Wyoming father and mother are reportedly suing their school district for allegedly helping their daughter socially transition  behind their backs. Sean and Ashley Willey are suing the Sweetwater County School District No. 1 board and some administrators for allegedly helping to gender-transition their daughter while actively hiding it from them. ""A Rock Springs couple said their school district helped their daughter socially transition to a boy behind their backs and has coerced teachers into secretly affirming transgender students. The couple is suing the district and its top administrators,"" the Cowboy State Daily reported. The debate over the ethics of allowing children to change their gender from male to female or vise-versa remains one of America’s most politically divisive topics. This debate is especially salient when it comes to education and its influence over children while their parents are at work. Transgender ideology has divided many other the role a school should play in affirming a child's chosen identity without the parent's knowledge or permission, as many argue this denies parents' role. (iStock) A WASHINGTON MOM CLAIMS HER SCHOOL TRIED TO ‘TRANSITION’ HER TEN-YEAR-OLD DAUGHTER BEHIND HER BACK ""The Willeys as parents assert three civil challenges against the district and administrators: that the defendants took away the Willeys’ parental and due process rights, familial privacy rights, and religious rights,"" Cowboy State Daily wrote. ""Ashley Willey alleges two more civil counts against the district and administrators as a teacher under their policies: that they took away her right to the free exercise of religion and right to free speech."" The same outlet also reported that the couple are asking the federal court to block this district’s policies that aid children transitioning in secret without their parents’ knowledge. One notable complication is that the school reportedly accommodates Sean and Ashley Willey's daughter's mental health issues already. ""The girl has a history of trauma and has been diagnosed with attention-deficit hyperactive disorder (ADHD) and post-traumatic stress disorder. She also has a 504 plan, or educational plan to accommodate her conditions, which requires the school to involve her parents in her mental health treatment,"" Cowboy State Daily reported. ""The Willeys have taken the girl to see a counselor for years, the complaint states."" A person wears a gender neutral pronoun jacket at a 'Rainbow Runway for Equality' to kick off Pride Month on June 01, 2022. (Photo by Lauren DeCicca/Getty Images) ((Photo by Lauren DeCicca/Getty Images)) TRANS PSYCHOLOGIST FILES BRIEF AGAINST MD. SCHOOL DISTRICT HIDING TRANSITIONS FROM PARENTS: 'TERRIBLE IDEA' School board Chairwoman Carol Jelaco reportedly claimed at a school board meeting in September that ""whatever the student wants is paramount"" when ""there is a fear from the student"" regarding parents learning of their gender transition process. Mailyn Salabarria, the director of community engagement for the parent activist group Parents Defending Education told the Washington Examiner that officials’ statements at the September meeting indicate that ""the war against our constitutional rights and our parental rights is out in the open, even in wild Wyoming."" ""This notion that keeping information from parents is for the sake of the students’ safety is laughable,"" Salabarria said. ""Educators and school administrators are mandatory reporters when it comes to abuse and neglect. Wyoming already has legislation in place to safeguard minors in those circumstances. If safety is the concern, why aren’t they using the process already in place?"" New policies, such as allowing teachers to wear this ""Equality"" badge contribute to an ongoing debate over whether the classroom has been politicized.  (Mid-Michigan Now) CLICK HERE TO GET THE FOX NEWS APP The New York Times quoted American Civil Liberties Union (ACLU) lawyer Jon Davidson who reportedly ""argued that it’s unconstitutional for public schools to reveal a student’s gender identity to others."" He reportedly argued, ""Parents don’t have a constitutional right to dictate to schools how they should create an optimal learning environment for students."" ACLU Southern California has a similar statement, ""even if you are ‘out’ about your sexual orientation or gender identity at school, if you're not ‘out' to your parents at home, and you can reasonably expect that they're not going to find out, then school staff can't tell your family that you are LGBTQ without your permission."" It added further, ""Being open about your sexuality in school doesn't mean you automatically give up your right to privacy outside school."" Alexander Hall is an associate editor for Fox News Digital. Story tips can be sent to Alexander.hall@fox.com. ",782,ENTERTAINMENT,
"Trump campaign cites progressive groups, Joy Reid's blog in attacks on Ron DeSantis","Fox News senior congressional correspondent Chad Pergram has more on former President Trump racking up endorsements on Gov. DeSantis' home turf and the growing GOP 2024 field on 'Your World.' Former President Donald Trump's campaign on Friday launched multiple attacks on Florida Gov. Ron DeSantis, a potential rival in the race for the 2024 Republican presidential nomination, citing multiple progressive groups and far-left MSNBC host Joy Reid's blog in doing so. In a press release titled, ""The Real Ron DeSantis Playbook,"" Trump's campaign cited data from the National Low Income Housing Coalition (NLIHC) and the Florida Policy Institute to blast DeSantis for what it said was data showing the state continuing ""to tumble into complete and total delinquency and destruction."" Additionally, Trump later posted on Truth Social with a quote from Reid's Wednesday blog, The ReidOut, which called DeSantis' trip to Washington, D.C. to meet with lawmakers this week a ""charm offensive,"" and ""a massive failure."" BIDEN TO OFFICIALLY ANNOUNCE RE-ELECTION BID NEXT WEEK: REPORTS Far-left MSNBC host Joy Reid on the set of her show, ""The ReidOut."" (Screenshot/MSNBC) According to the data Trump's campaign cited from the NLIHC, a group ""dedicated to achieving racially and socially equitable public policy,"" Floridians making just $10 have to work 86 hours per week in order to afford a single bedroom home. The data cited by Trump's campaign from the Florida Policy Institute, a non-partisan, but liberal-leaning, non-profit focused on the state's economic policies, listed Florida as one of the least affordable states in the country to live. Each of these points, Trump's campaign blamed on DeSantis and his leadership as Florida's governor. MAJOR PRO-LIFE GROUP THREATENS TO OPPOSE TRUMP CANDIDACY OVER ‘MORALLY INDEFENSIBLE’ ABORTION POSITION Florida Gov. Ron DeSantis, left, and former President Donald Trump, right. (Paul Hennessy/SOPA Images/LightRocket via Getty Images // Win McNamee/Getty Images) ""The real DeSantis record is one of misery and despair. He has left a wake of destruction all across Florida and people are hurting because he has spent more time playing public relations games instead of actually doing the hard-work needed to improve the lives of the people he represents,"" Trump spokesperson Stephen Cheung said in a statement. It isn't clear why Trump's campaign would cite Reid's blog in its attacks against DeSantis, as the liberal host has regularly railed against both men on her evening program. DeSantis has reportedly been mulling a run for the White House, but has yet to announce whether he will ultimately toss his hat into the ring and challenge Trump's front-runner status for the GOP nomination. Former President Donald Trump speaks to guests at the 2023 NRA-ILA Leadership Forum on April 14, 2023 in Indianapolis, Indiana. (Scott Olson/Getty Images) CLICK HERE TO GET THE FOX NEWS APP Fox News Digital reached out to DeSantis' campaign for comment but did not immediately receive a response. Brandon Gillespie is an associate editor at Fox News. Follow him on Twitter at @brandon_cg. ",489,POLITICS,politics
"There have been 1,080 attempts to punish scholars over the past 23 years: Report","A former law professor said university officials need to enforce their own policies after students and educators heckled a judge and stopped his remarks. A free-speech group found that there have been over 1000 attempts to punish scholars over the past 23 years. The Foundation for Individual Rights in Education released a ""Scholars Under Fire"" report showing that there have been 1,080 attempts to punish scholars over the past 23 years. The annual number of attempts has gone up from 4 in 2000 to 145 last year, according to the report. The report also found that 73% of those attempts to punish scholars have resulted in some sanction, including 225 terminations. Furthermore, they report that 3/4 of the firings were untenured scholars. FORMER GEORGETOWN LAW PROFESSOR CALLED RACIST BY STUDENTS AS HE DELIVERS LECTURE ON FREE SPEECH The report goes on to say show that 37% of attempts to punish faculty were initiated by undergraduate students. There were 213 sanction attempts that occurred in 2021 alone, more than in any other single year. A general view of the buildings of the Main Quadrangle and Hoover Tower on the campus of Stanford University in Palo Alto, California. (David Madison/Getty Images) The report includes a chart that shows which topics have driven the attempts to punish scholars. Among 21 topics that FIRE lists on the chart, race is the leading issue where scholars have been subject to scrutiny when addressing it in their profession. According to the report, some of the United States' most prestigious universities have had the highest number of sanction attempts, including Harvard University, Stanford University, University of California Los Angeles, Georgetown University, Columbia University, and the University of Pennsylvania. STANFORD LAW DEAN'S SHAMEFUL ATTACK ON FREE SPEECH MEANS THIS FOR THE EDUCATION MOB ""It should be no surprise that several of the schools with the highest number of sanction attempts are also ranked at the bottom of FIRE’s College Free Speech Ranking,"" FIRE tweeted. ""Cancel culture is particularly pernicious when it targets people charged with discovering and disseminating knowledge,"" said FIRE Director of Faculty Outreach Komi Frey, lead author of the report. College students sitting at rows of desks in classroom.  (Elina Shirazi) ""Vocal, dogmatic minorities on the left and the right are trying to restrict the range of acceptable ideas in institutions of higher education, and this should alarm us all. You do not need to agree with a scholar’s teaching, research, or extramural speech to recognize that censorship is not the answer."" CLICK HERE TO GET THE FOX NEWS APP Fox News Digital has previously reported on college professors speaking out against higher education for violating free speech rights. Ilya Shapiro, a former Georgetown University law professor, told Fox News Digital that university officials need to reprimand students and administrators who violate free speech policies and stop caving to the ""woke mob."" ""University officials … are spineless cowards unwilling to enforce their own rules when they're violated by students, much less administrators,"" Shapiro said. Shapiro was commenting on Trump-appointed Judge Kyle Duncan of the 5th Circuit Court of Appeals who was being heckled during a speech. Fox News' Megan Myers contributed to this report. Joshua Q. Nelson is a reporter for Fox News Digital. Joshua focuses on politics, education policy ranging from the local to the federal level, and the parental uprising in education. Joining Fox News Digital in 2019, he previously graduated from Syracuse University with a degree in Political Science and is an alum of the National Journalism Center and the Heritage Foundation's Young Leaders Program. Story tips can be sent to joshua.nelson@fox.com and Joshua can be followed on Twitter and LinkedIn. ",608,ENTERTAINMENT,
Jonathan Turley: Biden campaign got the media to buy into the Hunter laptop 'illusion',"Constitutional law professor and attorney Jonathan Turley on how the intelligence community worked with the Biden campaign to bury the Hunter Biden laptop story before the 2020 election. Constitutional lawyer Jonathan Turley slammed the media for its coverage of the Hunter Biden laptop scandal in the weeks before the 2020 presidential election. Turley contended that the media uncritically accepted the Biden campaign's talking point that the laptop was Russian disinformation. ""The media immediately said, we're not going to report on this. Even before the letter came out, they were resisting it,"" Turley said on Fox New's ""Brian Kilmeade Show"". ""Yet when they get this unsupported letter, they just immediately replicate it. They don't ask. They don't press on where it came from, who was behind it,"" he continued. Turley was referring to a letter that was signed by dozens of former intelligence officials that falsely claimed the contents of the Hunter Biden laptop were Russian disinformation. TRUMP CHIDES DESANTIS FOR LACK OF LOYALTY: ‘YOU JUST DON’T DO WHAT HE DID' WASHINGTON, DC - APRIL 12:  WFP USA Board Chair Hunter Biden introduces his father Vice President Joe Biden during the World Food Program USA's 2016 McGovern-Dole Leadership Award Ceremony  at the Organization of American States on April 12, 2016 in Washington, DC.  (Kris Connor/WireImage) Turley said much of the laptop material, such as the emails, could have been easily verified had the media done its due diligence. ""I think part of the reason is that the Biden campaign really was brilliant in how they handled this. They got the media to buy in to the illusion by calling an audience member to the stage to make something disappear,"" Turley said. TWITTER REMOVES LEGACY BLUE CHECKS CAUSING TRUMP, CLINTON, THE ROCK, AND OTHERS TO LOSE THEIR VERIFICATION First Lady Melania Trump, left, and President Donald Trump, center, remain on stage as Democratic presidential candidate former Vice President Joe Biden, right, walk away at the conclusion of the second and final presidential debate Thursday, Oct. 22, 2020, at Belmont University in Nashville, Tenn. (AP Photo/Julio Cortez) Turley also compared the Department of Justice's seemingly slow progress in its Hunter Biden investigation to the rapid indictments of various Trump campaign officials. ""I don't see how you can possibly look at these records and not find that he was an unregistered foreign agent. The Department of Justice slam various toward the various Trump officials with these FARA violations, including Paul Manafort,"" Turley said. President Joe Biden and his son, Hunter Biden, step off Air Force One, Saturday, Feb. 4, 2023, at Hancock Field Air National Guard Base in Syracuse, N.Y.  (AP Photo/Patrick Semansky) CLICK HERE TO GET THE FOX NEWS APP ""There are really strong analogies between this and the Manafort case. So that's an example of how this one seems to be moving at a glacial pace when they seem to move with great dispatch against people like Paul Manafort,"" he continued. President Biden is expected to announce his re-election bid next week. Joe Silverstein is a production assistant for Fox News Digital. ",510,ENTERTAINMENT,
