Title,Content,Number of Words,Category,SubCategory
Austin police chief knocks down 'rampant rumor' of serial killer in Texas capital,"The City Council approved the resolution after hearing testimony of family of loved ones who had disappeared or were found dead in Lady Bird Lake. A series of men found dead in downtown Austin who were roughly the same age and found in the same body of water are likely not the victims of a serial killer, according to the Texas capital's chief of police. Austin Police Chief Joseph Chacon said detectives suspected accidents or suicides in the recent string of deaths — but he left open the door should additional information become known to investigators. His statement comes as speculation that deaths in the city's Lady Bird Lake — four since February and double that over the past year — could have a connection. Of those, three were discovered near the edge of Rainey Street, a popular downtown strip, and a fourth was located about two miles downriver near a dam. BODIES STACK UP IN TEXAS CITY AMID FEARS OF SERIAL KILLER, RUMORS OF ‘ROOFIE’ ATTACKS Wooden fencing lines the edge of the trail between Rainey Street in downtown Austin and the Lady Bird Lake waterfront, where men have been discovered dead this year. (Matteo Cina/Fox News Digital) ""I realize that there is a rampant rumor about a potential serial killer here in Austin,"" Chacon told FOX 7 Austin. ""We've found no evidence of that."" ""Nothing has come to light that would indicate that there is a serial killer in Austin,"" the chief said. Police had a visible presence on Rainey Street over the weekend, out in force along the strip. City officials have also begun discussing ways to make the waterfront safer, including adding lights to the trails there and increasing Park Ranger patrols. They have also installed high temporary fencing. This undated photo is of Jason John, whose body was found in Lady Bird Lake, Austin, TX on Feb. 13, 2023. TEXAS SERIAL KILLER FEARS RISE AS LAKE DEATHS CLIMB TO 4 Austin police for weeks have said publicly that they have not uncovered evidence of foul play in any of the deaths, as their investigations continue. But many Austin residents, as well as independent investigators and web sleuths alike, have argued that the number of bodies found so close to one another is more than a coincidence, especially due to the distance between the strip of bars on Rainey Street and the waterfront itself. This undated photo is of Jonathan Honey, whose body was found in Lady Bird Lake, Austin, TX on Saturday, April 1, 2023. The edge of Lady Bird Lake is about a block and a half from the strip and requires climbing over a fence and down a trail. BANK ACCOUNTS OF NEW YORK ‘ROOFIE MURDER’ VICTIMS DRAINED VIA FACIAL RECOGNITION TECHNOLOGY Austin police identified the latest victim last week as John Christopher Hays-Clark, 30. He was pronounced dead at the scene near a dam about two miles down river from where the others were found, closer to Rainey Street. This undated photo is of Clifton Axtell, whose body was found in Lady Bird Lake, Austin, TX on in 2023. Police found Jason John, 30, dead in Lady Bird Lake in February, a week after he was last been seen on Rainey Street, which has a popular row of bars near the water. Clifton Axtell, 40, was identified as the man found dead on March 5. Jonathan Honey, 33, was found on April 1, a day after he was last seen at a food truck on Rainey Street. This undated photo is of Jonathan Clark, whose body was found in Lady Bird Lake, Austin, TX on Saturday, April 15, 2023. TEXAS POLICE ADDRESS FEARS OF SERIAL KILLER AFTER SECOND MISSING MAN FOUND DEAD IN AUSTIN LAKE Police in New York City last month announced multiple indictments and arrests in connection with a series of robberies that involved drugging victims at bars and using facial recognition technology to unlock their phones and drain their accounts. Several victims died as a result of overdosing on the drugs used to incapacitate them, according to police. The approximate locations of the four recent bodies found in Austin's Lady Bird Lake, based on estimations from local reports and ACTEMS. (Google Maps) Separately, the Austin deaths share eerie similarities to claims of a potential group of ""Smiley Face Killers"" who some investigators believe may have been responsible for dozens of drownings of young men in the Midwest beginning in the late 1990s. CLICK HERE TO GET THE FOX NEWS APP Residents were also monitoring the case of another missing man, Joel Derusha. Police told Fox News Digital Monday his remains were located on the 500 block of Thompson Lane Thursday morning. He was located around nine miles away from Rainey Street not in or near the water, and police said they found no evidence of foul play based on evidence uncovered so far. Michael Ruiz is a reporter for Fox News Digital. Story tips can be sent to michael.ruiz@fox.com and on Twitter: @mikerreports ",834,WORLD NEWS,us
Idaho student murders: Bryan Kohberger defense claims surviving roommate has 'exculpatory' evidence,"Correspondent Dan Springer reports the latest from Seattle, Washington. A defense investigator working on behalf of University of Idaho student murders suspect Bryan Kohberger asserted in a newly unveiled court filing that a surviving housemate has ""exculpatory"" information that is ""material and necessary"" to the alleged killer's defense. Kohberger, a former criminology Ph.D. candidate, is accused of entering an off-campus home on Nov. 13 around 4 a.m., after the occupants, all undergrad students at the school, had been out on a Friday night into early Saturday morning. Police allege he fatally stabbed four of the six people inside, Madison Mogen and Kaylee Goncalves, both 21, along with Xana Kernodle and Ethan Chapin, both 20. The three women lived there with the two survivors, while Chapin, Kernodle's boyfriend, was spending the night. Of the two survivors, one allegedly heard a commotion and witnessed a masked man exit through a rear sliding door, according to a police affidavit. IDAHO MURDER SUSPECT BRYAN KOHBERGER'S INTERNAL AFFAIRS DISCLOSURE UNLIKELY TIED TO STUDENT STABBINGS: EXPERTS Madison Mogen, top left, smiles on the shoulders of her best friend, Kaylee Goncalves, as they pose with Ethan Chapin, Xana Kernodle, and two other housemates in Goncalves' final Instagram post, shared the day before the four students were stabbed to death. The blurred faces are those of the victims' two surviving housemates. (@kayleegoncalves/Instagram) The second, a Nevada native named in the Nevada court filing made public Monday, allegedly heard or saw things that could clear the suspect, according to Richard Bitonti, a defense investigator working for Anne Taylor, Kohberger's court-appointed attorney. In the documents, obtained by Fox News Digital, the subpoena demands the roommate's appearance on June 28, two days into Kohberger's planned preliminary hearing, and warns of a potential fine of $500 or 25 days in jail if she refuses to appear. ""During the course of my investigation, it became known to me that [she] has information material to the charges against Mr. Kohberger,"" Bitonti wrote in an affidavit in support of the subpoena, revealed Monday after online sleuths found the case listed on a Washoe County, Nevada, court docket. A portion of that information, Bitonti added, ""is exculpatory to the defendant."" IDAHO MURDERS: BRYAN KOHBERGER LEAKS ‘HUGE ISSUE’ WITH ‘POTENTIAL TO COMPROMISE’ PROSECUTION, LAWYER WARNS Bryan Kohberger enters a courtroom in Moscow, Idaho on Jan. 12, 2023, for a status hearing. The accused murderer waived his right to a quick preliminary hearing and will appear in court again on June 26. (Kai Eiselein/Pool) The ""information is unique to her experiences and cannot be provided by another witness,"" according to the documents. As a result, Kohberger's defense is asking the court to compel her testimony at his scheduled preliminary hearing in June, as they hope to challenge the probable cause used to justify his arrest. As Fox News Digital has reported, prosecutors can sidestep his attempts to disprove probable cause by seeking a grand jury indictment behind closed doors. ""If there is no preliminary hearing, because there was a superseding indictment, the issue of the subpoena (at least for that hearing) becomes moot,"" Edwina Elcox, a Boise-based criminal defense attorney who previously represented Lori Vallow, told Fox News Digital. Bryan Kohberger, who is accused of killing four University of Idaho students in November 2022, looks on as his attorney, public defender Anne Taylor, speaks during a hearing in Latah County District Court, Jan. 5, 2023, in Moscow, Idaho. (AP Photo/Ted S. Warren, Pool) Even if a grand jury is empaneled behind closed doors, without involvement from Kohberger's defense team, prosecutors would be ethically bound to disclose potentially exculpatory evidence, she said. However, a grand jury would enable prosecutors to present the case without subjecting any witnesses to harrowing cross-examination from Kohberger's defense before trial. ""The prosecutor has to present such exculpatory evidence to the grand jury, even though the defense is not present,"" she said. IDAHO MURDERS: PROSECUTOR SAYS VICTIM'S FAMILY ‘POTENTIAL WITNESSES’ AS DEFENSE OPPOSES GAG ORDER APPEAL The law firm representing the surviving roommate declined to comment, citing Idaho Magistrate Judge Megan Marshall's gag order on the case. Magistrate Judge Megan Marshall speaks during a status hearing for accused murderer Bryan Kohberger on Jan. 12, 2023, in Moscow, Idaho. (Kai Eiselein/Pool) However, in a court filing opposing the subpoena, also published Monday, Reno-based attorney Kelli Anne Viloria argued that the Idaho subpoena was improperly filed and ""there is no authority for an Idaho criminal defendant to summon a Nevada witness to Idaho for preliminary hearing."" ""There is also no authority for an Idaho criminal defendant to summon a Nevada witness to an Idaho matter without a hearing and there is no authority to summon a Nevada witness to an Idaho matter without a Nevada judge making a finding of materiality, necessity and the lack of undue hardship,"" she added. IDAHO'S MOVE TO RESURRECT FIRING SQUAD ‘MAKES SENSE’ AS ‘QUICKEST, SUREST’ DEATH PENALTY OPTION, EXPERT SAYS State police investigators look for clues in Moscow, Idaho, on Nov. 21, 2022. Four University of Idaho students were found stabbed to death in the home a week earlier. (Derek Shook for Fox News Digital) At the time of the stabbings, Kohberger was a Ph.D. criminology student at Washington State University, a neighboring school less than 10 miles away from the Idaho campus. He finished out the semester and drove home, cross-country, with his dad riding shotgun. After his initial arrest, Kohberger's previous public defender in his home state of Pennsylvania said his client was looking forward to being exonerated. Taylor, his attorney in Idaho, ignored requests for comment from Fox News Digital prior to the gag order and has since remained silent. In court filings, her office has slammed what it calls ""grotesquely twisted"" media coverage of the home invasion stabbing that left four college students dead of multiple stab wounds each – some of whom were believed to have been sleeping at the start of the ambush. Defense attorney Anne Taylor joins investigators at a visit to the King Road crime scene on Jan. 3, 2023. Taylor is defending Bryan Kohberger, who is charged with four counts of first-degree murder. (Derek Shook for Fox News Digital) Experts have told Fox News Digital that they expect Latah County prosecutor Bill Thompson to be extra careful as he seeks a conviction in the potential death penalty case in order to avoid possible grounds for appeal. Last month, he informed Judge Marshall and Kohberger's team that his office would be disclosing this week ""potential Brady/Giglio material"" related to a police officer involved in the massacre probe – but that doesn't mean there is a connection with the stabbings of four University of Idaho students in November. CLICK HERE TO GET THE FOX NEWS APP Brady material is information that could potentially prove a defendant's innocence, experts tell Fox News Digital. Giglio material is damaging to the integrity of a witness – in this case, one of the officers involved in the investigation. In previously released court documents, investigators alleged they had linked the suspect to the crime scene through surveillance images of his car and phone records. They also found a knife sheath next to Mogen's body that allegedly contained DNA. Kohberger faces four counts of first-degree murder and another of felony burglary. His preliminary hearing is scheduled to begin on June 26 and could take several days. Fox News' Haley Chi-Sing contributed to this report. Michael Ruiz is a reporter for Fox News Digital. Story tips can be sent to michael.ruiz@fox.com and on Twitter: @mikerreports ",1254,WORLD NEWS,us
Alex Murdaugh faces new tax evasion indictments: report,"South Carolina Circuit Court Judge Clifton Newman sentenced Alex Murdaugh to serve two consecutive life sentences in prison after a jury found him guilty of murdering his wife and son. Convicted killer Alex Murdaugh was indicted last week on new tax evasion charges by a South Carolina grand jury, sources told FitsNews. The latest criminal indictments come a little more than a month after Murdaugh was found guilty of fatally shooting his son, Paul, 22, and his wife, Maggie, 52, in June 2021 to prevent his alleged financial crimes from coming to light. He was sentenced to two life terms, which he is serving at McCormick Correctional Institution in South Carolina. ALEX MURDAUGH'S LIFE IN LOCKUP: LAWYER REVEALS EXCLUSIVE DETAILS Alex Murdaugh is led out of the Colleton County Courthouse in Walterboro, South Carolina, on Feb. 27, 2023, during his murder trial for the double slaying of his son and wife in June 2021. (Mark Sims for Fox News Digital / File) Before the disbarred attorney's double-murder trial began, he was already facing 99 counts of financial crimes across 19 indictments. He is accused of stealing nearly $9 million from his former law firm, vulnerable clients and the government through tax evasion. CONVICTED KILLER ALEX MURDAUGH SENTENCED TO LIFE IN PRISON Murdaugh, 54, is expected to go to trial on the financial crimes cases in the coming months. Alex Murdaugh has been transferred to McCormick Correctional Institution in South Carolina. (South Carolina Department of Corrections | Google Maps) His lawyer, Jim Griffin, told Fox News Digital last week about the disgraced patriarch's new life in lockup at the maximum security facility near the Georgia border. Murdaugh, who is in protective custody with about 28 other prisoners, passes the time playing checkers and cards with his friends. ALEX MURDAUGH'S SECRET PRISON LOCATION REVEALED ""When he came in, he obviously had a lot of notoriety and was a celebrity of sorts, but he gets along with everybody in the pod,"" Griffin previously said. A photo of the Murdaugh family taken days before Paul and Maggie Murdaugh were shot to death shows, from left, Buster, Paul, Maggie and Alex. (Defense exhibit / File) The inmates, who each have their own cell, are allowed in the communal area of the pod from 9 a.m. to 4 p.m. There is also a small courtyard for fresh air, and they each have a tablet that can be used for phone calls, emails and limited internet access. The infamous prisoner has received a deluge of supportive letters, and strangers have donated about $1,000 to his commissary, Griffin said. A pair of hit docuseries, HBO Max's ""Low Country: The Murdaugh Dynasty"" and Netflix's ""Murdaugh Murders: A Southern Scandal,"" have amplified the ex-Hampton lawyer's celebrity. CLICK HERE TO GET THE FOX NEWS APP Murdaugh insists he is innocent and is appealing. A spokesperson for South Carolina Attorney General Alan Wilson, who is prosecuting the financial crimes cases, did not immediately return a request for comment. Griffin also did not immediately return a request for comment. Rebecca Rosenberg is a veteran journalist and book author with a focus on crime and criminal justice. Email tips to rebecca.rosenberg@fox.com and @ReRosenberg. ",529,WORLD NEWS,us
"Gabby Petito update: Laundrie family attorney seeks copies of texts, calls","Security camera video from the Whole Foods in Jackson, Wyoming, shows Gabby Petito and her suspected killer, fiancé Brian Laundrie, browsing the shelves on Aug. 27, 2021 – the last date she was seen alive. The attorney for Brian Laundrie's family is seeking copies of all the family's texts, calls and other phone records for a six-month stretch of 2021 obtained by the parents of Gabby Petito as part of a Florida civil suit connected to the travel blogger's murder. Her parents' attorney, Pat Reilly, obtained a subpoena earlier this year asking AT&T for records of calls, texts and other phone data from Brian, Christopher and Roberta Laundrie between July 2, 2021, and Nov. 13 of that year. Petito's parents are alleging that the Laundries caused them emotional distress and attempted to help their son escape justice after he strangled and bludgeoned their daughter to death during a cross-country ""van life"" road trip. In December, they added Laundrie lawyer Steve Bertolino to the lawsuit in a second amended complaint, and he asked for copies of the AT&T records on Thursday. ""The plaintiffs have no proof of what they have alleged in their court filings,"" Bertolino told Fox News Digital on Monday. ""Pat Reilly can seek high and low, but he will not find a scintilla of admissible evidence to support anything beyond conjecture."" GABBY PETITO'S PARENTS ASK BRIAN LAUNDRIE'S PARENTS ABOUT MAJOR WITHDRAWALS IN NEW COURT FILING Months after an outside investigation recommended changes for the Moab police domestic violence response, the city has shown little evidence of change, documents reveal. (Joseph Petito | Twitter Moab PD) Reilly did not immediately respond to a request for comment. The lawsuit alleges that Laundrie, his parents and their lawyer knew Petito was dead at the time of a Sept. 14 statement Bertolino released to the media, which reads, in part, ""On behalf of the Laundrie family it is our hope that the search for Miss Petito is successful and that Miss Petito is re-united with her family."" Her remains would be discovered on Sept. 19 at a campsite near Jackson, Wyoming. where she was last seen alive. Brian Laundrie allegedly killed her around Aug. 28. LAUNDRIE ATTORNEY FILES NEW MOTION TO DISMISS LAWSUIT FROM GABBY PETITO'S PARENTS Chris and Roberta Laundrie are shown at Myakkahatchee Creek Environmental Park on the morning when police discovered their son's remains. (Michael Ruiz / Fox News Digital / File) Fox News Digital was present in the Myakkahatchee Creek Environmental Park near the Laundrie family home in North Port, Florida, when authorities found his remains on Oct. 20, 2021. According to the FBI, Laundrie died of a self-inflicted gunshot wound. Near his decomposed remains, they found a handwritten suicide note and confession preserved in a dry bag and other personal affects. Separately, Reilly has asked the court to force the Laundries to turn over a letter in which Roberta Laundrie allegedly offered to lend her son a shovel to bury a body. Fox News Digital offered the first public glimpse of a confession Brian Laundrie left in a notebook in the Florida swamp where he killed himself. (Michael Ruiz / Fox News Digital / File) GABBY PETITO AND BRIAN LAUNDRIE: BOMBSHELL VIDEO EMERGES SHOWING HOURS BEFORE MURDER ""I don't feel comfortable summarizing the letter,"" he told Fox News Digital at the time. ""The content is very specific and best read when available. If my belief as to the time it was written is accurate, it shows that at least Roberta Laundrie knew of Gabby's murder before Gabby's body was located. The rest of the notebook contained letters to his family."" Roberta's letter was undated, he added, but ""the content of the letter seems to indicate that it was written after Gabby’s death."" Gabby Petito is shown with blood on her face during an Aug. 12, 2021, traffic stop in Moab, Utah. A 911 caller had reported seeing a man, later identified as Brian Laundrie, hitting her in public. (Parker & McConkie / File) Through their attorneys, the Laundries have maintained that the letter was written before Gabby and Brian left on their cross-country trip and has no connection to its grim outcome. NEW GABBY PETITO LAWSUIT FILING REVEALS BRIAN LAUNDRIE'S ‘MENTAL AND EMOTIONAL THREAT’ WEEKS BEFORE MURDER Earlier this month, Petito's parents asked Laundrie's parents to hand over financial information in the weeks around her death. The parties are due back in court on May 24. CLICK HERE TO GET THE FOX NEWS APP Chris and Roberta Laundrie have not been charged with a crime in connection with Petito's death. Michael Ruiz is a reporter for Fox News Digital. Story tips can be sent to michael.ruiz@fox.com and on Twitter: @mikerreports ",783,WORLD NEWS,us
