Title,Content,Number of Words,Category,Date Published,Link
The cost of the Ukraine war for one Russian regiment," Kostroma is not a bad place to go looking for the effects of the Ukraine war on Russia. For this city is home to a celebrated regiment that bears its name and has been in the forefront of all the main battles in the Kremlin's campaign against its neighbours. The 331st Guards Parachute Regiment, often called the Kostroma Airborne Regiment, has been the subject of investigations by BBC's Newsnight since shortly after last February's invasion. These have revealed the price paid by the regiment and its home community. We had confirmed 39 fatalities by April last year, 62 by late July, and now the toll has reached 94. Much of the work compiling this list has involved combing social media accounts on V'Kontakte, the Russian equivalent of Facebook, and local media reporting. We can then cross reference this with satellite and Google Street View imagery. One video discovered on V'Kontakte showed soldiers' graves at a cemetery north-east of Kostroma. The graves shown in the videos match the names of the soldiers we have collated. The actual number of 331st's dead is probably much higher. Some of the soldiers are from towns outside Kostroma, which makes tracking down information about them much more difficult. Several soldiers have been reported missing - some of these may count among the dead. When one considers those seriously wounded or taken prisoner, it's reasonable to assume that the Ukraine war has cost the regiment several hundred soldiers. The loss of life has caused much comment in Kostroma, which lies about 300km (186 miles) north-east of Moscow and has a population of around a quarter of a million. One local website noted last spring that the entire Soviet-Afghan war, lasting nine years, had cost the city 56 soldiers. Heavy losses in Ukraine have given the local authorities a difficult task of political management. Sergey Sitnikov, Kostroma's Kremlin-appointed governor, has been in the forefront of attempts to convince people that the city's soldiers are being properly supported. Gov Sitnikov's visits to hospitals, barracks, and indeed to the front, have been covered on local TV. On a visit to the front in December, Gov Sitnikov told viewers that ""we need to help [the] guys so they have decent conditions"". He had brought with him crowd-funded care packages and commercially sold drones. Gov Sitnikov is Vladimir Putin's placeman in his home region, so he's hardly a rebel or fearless teller of uncomfortable truths. But his willingness to visit the front and acknowledge shortcomings, even in a coded way, marks an interesting contrast with his boss. When local TV showed mobilised paratroopers on the 331st's parade ground six months ago, it also carried Gov Sitnikov's rather frank remarks to them: ""I'm wishing you good health, success, completion of all tasks… and that you return home alive."" The call-up of paratroopers, part of Russia's wider mobilisation, underlines the degree to which the Ukraine campaign has exhausted the country's professional army, of which the 331st has been a showpiece. In footage of November's parade, 150 conscripts were shown before their dispatch to the front. The total size of the 331st regiment could be estimated at 1,500-1,700. When it first sent into Ukraine in February 2022, it deployed two battalion groups, giving a total of 1,000-1,200 soldiers. After taking heavy casualties in the failed attempt to reach Kyiv, the regiment was withdrawn and rebuilt in the southern Russian garrison town of Belgorod last summer. Subsequent action has seen the regiment moving around all the major flashpoints - Izyum in the early summer, Kherson later on, and now back to Donbas. By monitoring the dates given in the death announcements on Kostroma social media, it's possible to work out when (and often where) the unit was used to spearhead assaults, and the lulls when it was removed from the line to lick its wounds.  For example, a cluster of deaths in February point to elements of the 331st being engaged in Kreminna. Russia's Long War Mark Urban reports on how the Russian 331st Regiment, and their families, are coping with Vladimir Putin's long war Watch now on BBC iPlayer (UK only) Each time casualty replacements - including the conscripts shown on TV in November - are brought in to replace losses, the original cadre of soldiers gets smaller, and the overall size of the unit diminishes. It may now number no more than 300-400 at the front. The losses, and indeed the return of badly wounded men, have resonated in the home community. A few weeks into the war, one user of V'Kontake exclaimed, ""Almost every day photos of our Kostroma boys get published. It sends shivers down my spine. What's happening? When will this end?"" Local media has been featuring commemorations of fallen Kostroma soldiers. In December, a TV station featured the unveiling of a plaque to Eduard Reunov, a paratrooper in the 331st who was killed in Ukraine. The style of this memorial and the language used in the report can be seen as an attempt to channel the Great Patriotic War (as the Russians call their 1941-45 fight against the Nazis), implying that today's soldiers are engaged in an equally important cause. But on social media, we've found more modern manifestations of remembrance, and even people seeking revenge. Soldiers are shown holding shells with messages scribbled on them from Reunov's former classmates, and, supposedly, his family. There's a trend seen in a few Russian garrison towns, for wives and mothers to post pictures of themselves with an absent soldier's uniform. One tearful mother of a dead paratrooper from the 331st remembers the Great Patriotic War, and adds, ""I hope there will be stories written about our guys"". Those questioning the sacrifice tend to get short shrift. ""Ukraine isn't my Motherland, our boys are dying for nothing,"" one person recently wrote on Kostroma's V'Kontakte page. Another swiftly countered, ""That's a stupid opinion. No point in writing that stuff here"". It's evident from coverage of Gov Sitnikov's activities that the authorities are trying to mollify those who are anxious about the killed and wounded. It's not clear how much support the war has from the wider Russian public, but the video we've seen suggests there's a good deal of solidarity among military families in Kostroma. The 331st's decline can also be measured in loss to machinery as well as personnel - particularly airborne infantry combat vehicles, known by the Russian initials BMD - that have been used up in successive battles. Initially, when the 331st was part of an Airborne Forces task force pushing towards Kyiv, we had difficulty identifying its vehicles in video of the fighting. A painted ""V"" was used to identify units from all of the various units in that task force, and an inverted triangle symbol with a ""3"" in the centre was also used by one other regiment apart from the 331st. As the fighting wore on, soldiers in the 331st added a further ad hoc marking to the V on their vehicles' sides - an exclamation mark painted next to the V. They may have done this precisely so their commanders could distinguish their armour from the other regiments'. Consequently we were able to identify individual BMDs from the 331st being loaded up on railcars in March 2022, following their withdrawal from Ukraine. They then reappeared in Donbas during last summer's fighting. Open source analysts have also identified at least 25 destroyed BMDs marked in this way, by combing Ukrainian military social media accounts. As with the dead soldiers, this visible loss does not represent the total, since many other BMDs belonging to the Kostroma regiment have likely been lost outside the view of Ukrainian troops. A report broadcast in February 2023 by the Russian network NTV shows an ""armoured group"" of the 331st in action in Luhansk. But it just tends to confirm the impression we've gleaned from other sources that the regiment survives as small detachments able to spearhead certain missions. From the call signs seen on camera this element consists of just three BMD armoured vehicles. So, the regiment's long war goes on. Of the war's wider effects on the Ukrainian population you will glean little from Russian media, nor is there any frank coverage of war-crime allegations. The 331st were accused of massacring hundreds of Ukrainian soldiers during fighting in 2014. For many Ukrainians, the latest Russian losses may seem like nothing more than the paratroopers getting their just deserts. Meanwhile, in Kostroma's graveyard there is plenty of evidence of the price of failure in Russia's invasion. Buried too is the regiment's reputation as ""the best of the best"", and its dreams of easy victory. Additional research Maria Jevstafjeva and Louis Harris-White ",1449,world,2023-04-05T23:05:34.000Z,https://www.bbc.com/news/world-europe-65179074
Video shows moment Russian fighter jet hits US drone over Black Sea," The US military has released footage of a Russian jet crashing into one of its drones over the Black Sea. The US said the damage to the large drone meant it had to be brought down into the water near Crimea on Tuesday. Russia denied its Su-27 fighter jet clipped the propeller of the drone, but the video appears to back up the American version of events. It was in the Pentagon's interest to release this video - not least to verify its version of events. The BBC has not seen the events before or after the collision. The US initially said the confrontation lasted around 30-40 minutes, but the released footage lasts for less than a minute. On Wednesday night, US Defence Secretary Lloyd Austin said: ""We remain confident in the facts we've conveyed so far."" He said then the Pentagon was looking at what video could be released. It is not unusual for militaries to take some time to declassify video footage before making it public. Mr Austin previously described Russia's actions as dangerous and reckless - and the edited video released appears to back that up. A feed from a camera fitted under the fuselage of the surveillance drone shows a Russian Su-27 making two extremely close passes while releasing what appears to be fuel as it approaches. In the first pass it seems to mire the lens of the camera. The second pass is even closer - disrupting the video feed from the remotely piloted aircraft. When the picture returns, a blade of the drone's propeller at the back of the aircraft can be seen bent out of shape. National Security Council spokesman John Kirby told the BBC's US broadcast partner CBS that it was not clear whether the Russian action was deliberate or accidental. But he said this did not matter because the moves were ""completely inappropriate, unsafe and unprofessional"". Surveillance flights would continue over the Black Sea, he said, but there was no need for military escorts, which he said were unnecessary and would put pilots at risk. Russia has claimed the drone was approaching its territory, but all we can see from the video is sea, sky and cloud. Moscow appeared to suggest on Tuesday that it had imposed a unilateral no-fly zone over the region as part of its invasion of Ukraine. Russian Ambassador to the US Anatoly Antonov said the drone had ""violated boundaries of the temporary airspace regime established for the special military operation"". But Mr Kirby said the airspace was international and not restricted. In a statement released hours after the crash, the US said Russian jets dumped fuel on the drone several times before the collision. Pentagon spokesman Brig Gen Pat Ryder told reporters the drone was ""unflyable and uncontrollable"", adding the collision also likely damaged the Russian aircraft. Russia's defence ministry said the drone crashed after a ""sharp manoeuvre"", and that it was flying with its transponders (communication devices) turned off. The Kremlin has not yet responded to the release of the US video. On Wednesday Russia's security council secretary Nikolai Patrushev said attempts were being made to find and retrieve the remnants of the drone. On Thursday, Russian ships were seen at the site of the downed drone on the Black Sea, US media reported. Mr Kirby said the US was also searching for the aircraft, but stressed that if Russia beat them to it, ""their ability to exploit useful intelligence will be highly minimised"". That message was reiterated by General Mark Milley, America's top military general, who said the US has taken ""mitigating measures"" to ensure there was nothing of value on the downed drone. ",610,world,2023-03-16T18:44:20.000Z,https://www.bbc.com/news/world-europe-64975766
Bakhmut: Russian casualties mount but tactics evolve," Ukraine has drawn a line in the dirt, and that line is Bakhmut. It is a city that few say matters strategically, but that tens of thousands have died fighting over. It began more than seven months ago, and is the longest battle of the war so far. Two Ukrainian army brigades defending the city's southern flank gave the BBC access to their positions last week as fierce fighting continued in and around Bakhmut. The men have spent months facing both regular Russian army forces, and prisoners recruited by the Wagner private military group who have swarmed their trenches in droves. Troops say Russian casualties far outweigh theirs, but the enemy is deploying new techniques to try to seize the city and surrounding countryside. Ukraine's forces are outgunned and outnumbered, but on a chalk hillside to the south, there is the anti-tank group from the 3rd Separate Assault Brigade. 3Storm - as they are known - are unyielding. They've dug trenches deep into the earth. Timber props supporting the roof shudder as Russian artillery lands in the near distance, and field mice scurry along duck boards. An antiquated field telephone sits in a wooden nook; these are conditions their grandfathers would recognise. ""They cannot get to us, we can see for a kilometre in all directions,"" says a bearded 26-year-old soldier who goes by the call sign ""Dwarf"", pointing out Russian positions. ""We can hit the enemy with everything we have,"" he says. Neither the Russian nor Ukrainian armies release official casualty figures for Bakhmut, or elsewhere, but the mostly abandoned city has become a slaughter house. In a week fighting for the city, Dwarf's company faced conscripted prisoners from Russia's Wagner group. ""We had battles every two hours,"" he says. ""I guess a single company eliminated 50 people per day."" In case of any doubt, he points out these numbers were confirmed by aerial reconnaissance. ""The [Russian vehicle] arrives, 50 bodies come out, a day passes, 50 bodies come out again,"" he says. His company lost a fraction of that number, he says. Officially, Ukraine estimates that for every one of its soldiers killed, Russia loses seven. Earlier this week, Russia said it had killed more than 220 Ukrainian service members in a 24-hour period in the battle for Bakhmut. None of these numbers can be independently verified. In a newspaper interview, two captured Wagner conscripts told the Wall Street Journal that before they are sent forward, they receive little training beyond learning to crawl through forests in the dark. After six months serving at the front they are freed - assuming they survive. Conditions all along the 600-mile-long eastern front have begun to change. 3Storm's chalky hilltop hideout feels like dry land compared with the surrounding territory. An early spring has turned the hard ground of winter to mud porridge - which may favour the defenders. To get there, we had to follow the Ukrainian soldiers on foot - within a few paces my boots become lumpen and heavy with thick dirt. A battlefield ambulance speeds by unsteadily, its caterpillar tracks ploughing up the ground, and spraying pools of sludge as it struggles for grip. The villages around here - the location can't be revealed - are in ruin. Handwritten signs on gates, mostly in Russian, announce ""People Live Here"", a plea as much as it is a statement. But the streets are entirely empty, apart from abandoned dogs who roam the ruins of destroyed farms and homes. For the past two months, Russian forces have steadily advanced, trying to encircle Bakhmut. The commander of Ukrainian ground forces, General Oleksandr Syrsky, says his forces will continue to resist. ""Every day of steadfast resistance wins us valuable time to reduce the enemy's offensive capabilities,"" he says, sending more reinforcements to the area. But it isn't only Russians who have fallen into the Bakhmut trap. Ukrainians are dying there, too, in ever increasing numbers. On the hillside, a group of soldiers have gathered around a gun position, and I ask Dwarf - given that Ukraine is losing soldiers to untrained Russian convicts - if the defence of dead city, surrounded by the enemy, makes sense. He says, ""I was wondering, myself, if we should keep defending Bakhmut. On the one hand what's happening here now is awful. There are no words to describe it. But the alternative is we give up Bakhmut and move to another settlement. What's the difference between defending Bakhmut or any other village?"" His comrade, a strongly built man with a full dark beard who goes by the call sign Holm, agrees. ""It's not a strategic question for us here. We are ordinary soldiers. But this is our land. We may then retreat to Chasiv Yar, from Chasiv Yar to Slovyansk, and so we retreat up to Kyiv. Let it take a year or two, four, five - but we have to fight for every piece of our land."" The men have been fighting for more than a year now, and they say the Russians are evolving. ""They are learning, they are getting cleverer, and it really freaks me out,"" says Dwarf. ""They send out a group - five morons taken from prison. They are shot, but the enemy sees where you are, walks around, and you are surrounded from behind."" Holm chimes in that Russia is now using drones armed with grenades more effectively. ""We used to drop them and freak them out,"" he says. ""Now they're dropping drone grenades on our positions."" Before the war, Dwarf was an outdoor youth worker and would take youngsters hiking in the Carpathian Mountains on the country's western edge. Here on Ukraine's eastern front, that is a far-off memory. He's been in many battles since then, but the horror of Bakhmut is what lives with him now. When I ask about Wagner's convict army, he pauses to think and says, ""I'll be honest. It's genius. Cruel, immoral, but effective tactics. It worked out. And it's still working in Bakhmut."" Days later, I'm back in the same area, crammed with four others into a Soviet-era UAZ jeep. Its steering wheel has the BMW logo - a joke says the driver, Oleg. He says little else as he grips the wheel and concentrates hard as the car whines and struggles over hills and through the shoals of muck. The automatic gunfire ahead signals we are nearing the 28th Mechanised Brigade, who are directly facing the Russians. The landscape of war shifts in an instant - the men are holed up in a small wood, its trees shattered and split by Russian fire. In a month, the wood will offer them cover. For now, its bare branches expose them to surveillance drones. Nearby there's an exchange of gunfire, and Russian shells strike around 500m away. But Borys, a 48-year-old former architect who is serving now as a captain, seems untroubled. ""Today's war is a drone war,"" he says, ""but we can walk around freely, because there's wind and rain today and drones are blown away. If it was quiet today, both our drones and our enemy's would be hovering over us."" On the way back, Oleg brings the jeep to a sudden halt. Lying in the dirt in front of us is a drone that has been blown off course. Its battery is quickly removed and it is brought inside - it turns out to be Ukrainian. But today's war isn't so very different from the past. Two nights before, the 28th Brigade was attacked by Russian infantry and tanks. In a timbered gun position below ground, the cold rain drips through the roof onto the dirt floor, and there, peering out into the bare landscape, is a Maxim belt-fed machine gun with stout iron wheels. ""It only works when there is a massive attack going on…then it really works,"" says Borys. ""So we use it every week"". And this is how the battle for Bakhmut is being fought, as winter turns to spring in 21st Century Europe. A 19th Century weapon still mows down men by the score in the black Ukrainian earth. ",1353,world,2023-03-16T06:10:23.000Z,https://www.bbc.com/news/world-europe-64955537
