Title,Content,Number of Words,Category,Date Published,Link
"Cause of grey hair may be 'stuck' cells, say scientists"," US scientists believe they may have uncovered why hair turns grey as we age, citing pigment-making cells which lose the ability to mature. The arrested development impacts immature cells which would otherwise have developed into melanocytes which give hair its natural colour or shade. The team from New York University (NYU) studied the process in mice, which have identical cells for fur colour. They say the work could provide a basis for reversing the greying process. According to the British Association of Dermatologists (BAD), work on melanocytes might also help our understanding and treatment of certain cancers and other medical conditions too. We grow and shed hair all the time - it's a normal cycle that happens throughout life. New hair grows from hair follicles, found in the skin, where the pigment-producing melanocytes also reside. Melanocytes continuously decay and renew too. New ones are made from stem cells and it's these cells that the researchers believe become ""stuck"" in limbo in people whose hair has turned grey. NYU Langone Health team used special scans and lab techniques to study the cell-ageing process. As hair ages, sheds and then repeatedly grows back, increasing numbers of the melanocyte stem cells become sluggish at their job. The stem cells stop roaming around the follicle and become fixed, thereby failing to mature into fully-fledged melanocytes. With no pigment being produced, the hair turns grey, white or silver. ""Our study adds to our basic understanding of how melanocyte stem cells work to colour hair,"" study lead investigator Dr Qi Sun, a post-doctoral fellow at NYU Langone Health, told Nature journal. ""The newfound mechanisms raise the possibility that the same fixed-positioning of melanocyte stem cells may exist in humans. If so, it presents a potential pathway for reversing or preventing the greying."" It is not the first time scientists have suggested that greying hair might be a partially reversible process. Poor nutrition is one possible, treatable cause of premature greying. Some researchers claim stress might contribute to human hair turning white, and have suggested removing anxiety might restore the pigmentation process - at least for a while. Other research suggests genetics, or our DNA, partly determines when we go grey. While some prefer to hide grey hair with dye, others embrace it. Some even choose to get ahead of nature, and prematurely colour hair silver, white or grey. According to Glamour Magazine, silver hair is ""the spring hair colour trend that the cool girls are rocking"". ""We've spotted one shade, in particular, taking off. Oyster grey is the fresh, breezy, pearlescent colour trend that's cropping up all over Instagram,"" the article says. One hairstylist, Luke Hersheson, recently told British Vogue: ""At one point it was a big no-no to have grey hair, but now we don't equate grey hair with being 'old' - so many people are doing it. ""Post-lockdown, there is a feeling of liberty - many got into a grey hair rut because they couldn't see their colourists, but came out of the other side and actually enjoyed the change."" Experts advise against plucking out 'rogue' grey hairs. It won't stop the next one that grows from the same follicle from being grey. If you damage the hair follicle, it may be hard for new hair to grow, meaning you could be left with less hair or even bald patches. Dr Leila Asfour from the British Association of Dermatologists told the BBC work on hair colour was big business: ""The global hair colour market is projected to attain a value of $33.7bn by 2030. Clearly there's a demand. ""The obvious implication of this research, when it comes to the general public, is that it means being one step closer to finding a way to reverse our grey hairs. ""But this study's results help the medical field understand better other conditions where these stem cells may have a role - for example, understand the underlying nature of the deadliest skin cancer we treat called melanoma."" It might help with a medical condition called alopecia areata too, where the immune system attacks the hair and causes it to fall out. Sometimes the hair grows back white in these patients, she explained. And it could give more clues about vitiligo - a skin condition where patients develop white skin patches. Scientists have tried surgically placing hair follicles in the affected areas to help regenerate the colour from the pigment found in the hair follicle. ""More research is needed,"" Dr Asfour says. Dr Yusur Al-Nuaimi from the British Hair and Nail Society said scalp health was important for supporting good head hair growth, especially as we age. ""The recent study in mice adds to our understanding of the hair follicle and how the pigment-producing cells function. We are already discovering more about the potential of stem cell therapies for conditions including hair loss and studies such as this one, with new findings about the colour-producing cells, may lead to an array of future treatment options for our patients."" ",830,health,2023-04-19T15:07:05.000Z,https://www.bbc.com/news/health-65309374
What is the Marburg virus and how dangerous is it?," The Marburg virus has killed five people in north-west Tanzania. The highly-infectious disease is similar to Ebola, with symptoms including fever, muscle pains, diarrhoea, vomiting and, in some cases, death through extreme blood loss. Hundreds of people have died from the virus in recent years, almost all in Africa. According to the World Health Organization (WHO), on average, the Marburg virus kills half of the people it infects, with previous outbreaks killing between 24% and 88% of patients. The virus was first identified in 1967 after 31 people were infected and seven died in simultaneous outbreaks in Marburg and Frankfurt in Germany, and Belgrade in Serbia. The outbreak was traced to African green monkeys imported from Uganda. But the virus has since been linked to other animals. Among humans, it is spread mostly by people who have spent long periods in caves and mines populated by bats. In recent years, there have also been outbreaks of the Marburg virus in: A 2005 outbreak in Angola killed more than 300 people. However, in the rest of the world, only two people have died from the Marburg virus in the past 40 years - one person in Europe and one in the US. Both had been on expeditions to caves in Uganda. Five people have died in Tanzania's north-western Kagera region. Three other people are being treated in hospital and authorities are tracing 161 contacts. This follows an outbreak in Equatorial Guinea in February, which is known to have infected nine people and killed seven. The WHO is investigating 20 more probable cases there. Other major outbreaks include: The virus begins abruptly with: This is often followed, three days later, by: According to the WHO, ""the appearance of patients at this phase has been described as showing 'ghost-like' drawn features, deep-set eyes, expressionless faces and extreme lethargy."" Many people go on to bleed from various parts of the body, and some die eight to nine days after first falling ill, because of extreme loss of blood and shock. African green monkeys and pigs can carry it. The Egyptian rousette fruit bat often also harbours the virus. Among humans, it spreads through bodily fluids and contact with contaminated bedding. Even after people have recovered, their blood or semen can remain infectious for many months afterwards. There are no specific treatments or a vaccine for the virus. But a range of blood products, drug and immune therapies are being developed, the WHO says. Doctors may be able to alleviate the symptoms by giving hospital patients plenty of fluids and using transfusions to replace lost blood. People in Africa should avoid eating or handling bushmeat, according to Gavi, an international health organisation. People should also avoid contact with pigs in areas with an outbreak, says the WHO. Men who have had the virus should use condoms for a year after the onset of symptoms or until their semen tests negative for the virus twice. Those who bury people who have died from the virus should also avoid touching the body. ",505,health,2023-03-23T11:18:43.000Z,https://www.bbc.com/news/health-62206270
Candida auris: What is the deadly fungus sweeping through US hospitals?," The drug-resistant fungus Candida auris (C. auris) was only discovered some 15 years ago but is already one of the world's most feared hospital microbes. If it gets inside the body, the yeast-type fungus can affect the bloodstream, the nervous system and several internal organs. The World Health Organization (WHO) estimates that its mortality rate ranges from 30% to 53% of patients affected by an invasive infection. What is more worrisome is that the fungus has proven to be resistant to the most common types of antifungal drugs. Some strains are resistant to all of the medicines we have, says BBC's health correspondent James Gallagher. According to the US Centers for Disease Control and Prevention (CDC), there have been outbreaks in more than 30 countries. A 2020 review from case reports from those nations found almost 4,750 cases globally between 2009 and 2019. The CDC said new data showed the fungus has ""spread at an alarming rate in US healthcare facilities"" in 2020 and 2021. Clinical cases in the country trebled - from 476 in 2019 to 1,471 in 2021. Also, a 2019 study by an international team of researchers suggested that rising temperatures linked to climate change may have played a role in the rising number of Candida auris infections. Here is everything you need to know about this deadly superbug. Candida auris (C. auris) is a yeast, a family of fungus which contains species pretty helpful to humans in activities such as bread-making and beer-brewing, but which also features species that cause infections in humans. One example is the very common Candida albicans, which causes thrush but also may trigger more severe infections. C. auris was first discovered in the ear canal of a patient at the Tokyo Metropolitan Geriatric Hospital in 2009, which inspired its name (auris is Latin for ear). Most of the time, Candida yeasts live on our skin without causing problems, but they can cause infections if we are unwell or they get into the wrong place, like the bloodstream or the lungs. C. auris most frequently causes bloodstream infections, but it can also affect the respiratory system, the central nervous system and internal organs, as well as the skin. These infections are usually quite serious. The fungus is often resistant to the usual drugs, which makes infections difficult to treat. ""The biggest problem with this fungus is its resistance to the drugs we have,"" said Dr Tina Joshi, associate professor in Molecular Biology at the University of Plymouth, in the UK. ""But another issue is that identifying a C. auris infection is quite difficult and it can easily be mistaken for other fungi, leading to the wrong treatment."" This means that the patient might be ill for longer, or get worse before accessing the appropriate treatment. Transmission is mainly through contaminated surfaces in hospitals. It sticks to intravenous lines and blood pressure cuffs. It's really hard to clean off, according to Dr Neil Stone, leading fungal expert at the Hospital for Tropical Diseases, University College London. The solution is often to close off entire wards. ""It is the most worrying fungi and we ignore it at our peril,"" Dr Stone said. ""It could shut down entire healthcare systems."" In a statement issued on 20 March, the CDC said new data showed that the fungus has ""spread at an alarming rate"" in the US. It is unlikely that you will pick up a C. auris infection going about your daily life. However, the risk is higher if you are in a hospital for a long time or if you are in a nursing home, and patients who are in intensive care are much more likely to get a C. auris infection, according to the CDC. The risk of picking up an infection is also higher if you have been on antibiotics a lot, because the drugs also destroy good bacteria that can stop C. auris getting in. Resistance to the common antifungal drugs, like fluconazole, has been seen in the majority of C. auris strains. This means that these drugs do not work on C. auris. Because of this, less common antifungal drugs have been used to treat infections, but C. auris has now developed resistance to these, too. DNA evidence shows that the antifungal resistance genes in C. auris are very similar to those found in the very common C. albicans. This suggests that the resistance genes may have passed from one species to the other. A 2019 study, published by the journal mBio from the American Society for Microbiology, suggested that the reason C. auris infections have become so common may be because this species has been forced to live at higher temperatures because of climate change. Most fungi prefer the cooler temperatures found in soil. But, as global temperatures have risen, C. auris has been forced to adapt to higher temperatures. This may have made it easier for the fungus to thrive in the human body, which is warm at 36C to 37C. A better understanding of who is most at risk of contracting a C. auris infection is the first step towards reducing the number of infections. ""We are behind the curve in what concerns the study of fungi,"" Dr Joshi said. ""I am not surprised at all we are now having to catch-up with it."" Healthcare professionals need to know that people who spend long periods of time in hospitals or nursing homes or those who have a weakened immune system are at higher risk. Not all hospitals identify C. auris in the same way. They are sometimes mistaken for other fungal infections, like thrush, and the wrong treatment is given. Improving diagnosis will help to identify patients with C. auris earlier, which will mean that the right treatment is given - preventing the spread of infection to other patients. But above all, infection prevention efforts need to be improved, said Dr Joshi. ""The main measure is infection prevention and control, because we have already seen how difficult it is to tackle what it does to patients."" ""Hospitals need to be on top of disinfecting and cleaning."" Not quite. In its first-ever list of fungal ""priority pathogens"", published last October, the WHO named no less than 19 fungi that represent a great threat to public health. C. auris was one of four fungi to appear in the ""critical priority"" group, being described by the WHO as ""intrinsically resistant to most available antifungal medicines"". This article has been adapted from material produced by Lena Ciric and James Gallagher. ",1088,world,2023-03-23T17:37:26.000Z,https://www.bbc.com/news/world-us-canada-65055878
Abortion pills explained in 60 seconds, ,1088,world,2023-03-23T17:37:26.000Z,https://www.bbc.com/news/world-us-canada-65047194
More people could have hidden bowel condition," Many people may be suffering from an undiagnosed and misunderstood bowel condition, according to the charity Guts UK. Microscopic colitis is an inflammation of the large bowel and causes frequent watery diarrhoea, stomach pain, faecal incontinence, fatigue and weight loss. About 17,000 people are diagnosed each year in the UK, but experts say the real number is likely to be higher. Some standard tests for inflammatory bowel conditions do not spot it. But despite misdiagnoses, cases have risen in the UK in recent years. Victoria Rennison, 33, from South London, was diagnosed with microscopic colitis last year, after more than a decade of symptoms. She saw a number of specialists but was told she had irritable bowel syndrome and ""was left to get on with it"". When the condition was at its worst she would spend the entire day and many nights on the toilet, or running urgently to the bathroom. ""The diarrhoea would come on suddenly and would be profuse and watery and the pain was like intense cramps,"" said Victoria. ""There were even times my infant son had to sit on a bouncer in the bathroom with me for hours."" She told BBC News: ""I used to be sociable and outgoing but I found it harder and harder to go out. ""I didn't want to leave the house. I had to make a map of every toilet to do so."" Victoria was finally diagnosed after a gut specialist did a colonoscopy (camera test of her bowel) and - crucially - took biopsy samples of the inflamed bowel. On previous visits to doctors she had had colonoscopies, but no biopsy samples had been taken and the condition - which can be seen clearly when samples are put under a microscope - was missed. She says it was a huge relief to get a diagnosis and be given treatment. ""It was not possible to keep living like that with a small child. I feel like I've finally regained some semblance of normality."" Julie Harrington, CEO of Guts UK, said it was crucial to provide training for healthcare providers, and continue to raise awareness, and invest in research. She added: ""It is terribly sad that thousands of people are suffering with the debilitating symptoms of microscopic colitis. ""Most people with the condition can be easily treated with a course of gut-specific steroids or with symptom-relieving medicines, but getting a diagnosis is the first, essential step."" Prof Chris Probert, at the University of Liverpool, said: ""It is not clear why cases of the condition are on the increase, but it is likely to be due to a mixture of increased awareness of symptoms leading to more diagnoses, and environmental factors. ""The good news is that effective treatments are available, so people experiencing symptoms could benefit enormously by talking with their GP."" ",469,health,2023-04-16T23:11:04.000Z,https://www.bbc.com/news/health-65276600
Gel nails: Investigation launched into gel polish allergic reactions," The government is investigating reports that growing numbers of people are developing life-changing allergies to some gel nail products. Dermatologists say they are treating people for allergic reactions to acrylic and gel nails ""most weeks"". Dr Deirdre Buckley of the British Association of Dermatologists urged people to cut down on gel nail use and stick to ""old-fashioned"" polishes. She is now urging people to stop using DIY home kits to treat their nails. Some people have reported nails loosening or falling off, skin rashes or, in rarer cases, breathing difficulties, she said. On Friday, the government's Office for Product Safety and Standards confirmed it was investigating and said the first point of contact for anyone developing an allergy after using a polish is their local trading standards department. In a statement it said: ""All cosmetics made available in the UK must comply with strict safety laws. This includes a list of ingredients to enable consumers with allergies to identify products that may be unsuitable for them."" Although most gel polish manicures are safe and result in no problems, the British Association of Dermatologists is warning that the methacrylate chemicals - found in gel and acrylic nails - can cause allergic reactions in some people. It often occurs when gels and polishes are applied at home, or by untrained technicians. Dr Buckley - who co-authored a report about the issue in 2018 - told the BBC it was growing into ""a very serious and common problem"". ""We're seeing it more and more because more people are buying DIY kits, developing an allergy and then going to a salon, and the allergy gets worse."" She said in ""an ideal situation"", people would stop using gel nail polish and go back to old fashioned nail polishes, ""which are much less sensitising"". ""If people are determined to continue with acrylate nail products, they should get them done professionally,"" she added. Gel polish treatments have spiked in popularity over recent years because the polish is long-lasting. But unlike other nail polishes, gel varnish needs to be ""cured"" under a UV light to dry. However, the UV lamps that are purchased to dry the polish do not work with every type of gel. If a lamp is not at least 36 watts or the correct wavelength, the acrylates - a group of chemicals used to bond the gel - do not dry properly, penetrating the nail bed and surrounding skin, causing irritation and allergies. The allergies can leave sufferers unable to have medical treatments like white dental fillings, joint replacement surgery and some diabetes medications. This is because once a person is sensitised, the body will no longer tolerate anything containing acrylates. Dr Buckley said she saw one case where a woman had blistering over her hands and had to have several weeks off work. ""Another lady was doing home kits that she purchased herself. People don't realize they're going to become sensitized to something which has huge implications that have nothing to do with nails,"" she added. Lisa Prince started having problems when she was training to be a nail technician. She developed rashes and swelling all over her face, neck and body. ""We were taught nothing about chemical composition of the products we were using. My tutor just told me to wear gloves."" After tests, she was told she was allergic to acrylates. ""They told me I was allergic to acrylates and would have to let my dentist know because it would affect that,"" she said. ""And I would no longer be able to have joint replacements."" She said she was left in shock, saying: ""It's a scary thought. I've got really bad legs and hips. I know that some point I'm going to need surgery."" There are many other stories like Lisa's on social media. Nail technician Suzanne Clayton set up a group on Facebook when some of her clients started reacting to their gel manicures. ""I started the group so that nail techs had a place to talk about the problems we were seeing. Three days later, there was 700 people in the group. And I was like, what's going on? It was just crazy. And it's just exploded since then. It just keeps growing and growing and growing"". Four years on, the group now has in excess of 37,000 members, with reports of allergies from more than 100 countries. The first gel nail products were created in 2009 by the American firm Gelish. Their CEO Danny Hill says this surge in allergies is concerning. ""We try so hard to do all the things right - training, labelling, certification of the chemicals that we use.  Our products are EU compliant, and also US compliant. With internet sales, products are from countries that do not comply to those strict regulations, and can cause severe irritation to the skin."" ""We've sold close to 100-million bottles of gel polish around the world. And yes, there are cases when we do have some breakouts or allergies. But the numbers are very low."" Some nail technicians have also said the reactions are giving some in the industry cause for concern. Formulations of gel polishes do differ; some are more problematic than others. The founder of the Federation of Nail Professionals, Marian Newman, says gel manicures are safe, if you ask the right questions. She has seen ""lots"" of allergic reactions affecting customers and nail technicians, she said. She is also urging people to ditch their DIY kits. She told BBC News: ""People that buy DIY kits and do gel polish nails at home, please don't. What should be on the labels is that these products should be used by a professional only. ""Choose your nail professional wisely by their level of education, training and qualifications. Don't be shy to ask. They won't mind. And make sure they're using a range of products that have been made in the in Europe or in America. As long as you understand what to look for, it is safe."" She added: ""One of the most recognized allergens is an ingredient names Hema. To be safer find someone who uses a brand which is Hema-free, and there are plenty of them now. And, if possible, hypoallergenic."" If you have experienced adverse effects to gel nail polish, you can get in touch by emailing haveyoursay@bbc.co.uk. Please include a contact number if you are willing to speak to a BBC journalist. You can also get in touch in the following ways: If you are reading this page and can't see the form you will need to visit the mobile version of the BBC website to submit your question or comment or you can email us at HaveYourSay@bbc.co.uk. Please include your name, age and location with any submission. ",1123,uk,2023-04-14T12:45:22.000Z,https://www.bbc.com/news/uk-65273991
Singing strikers on the junior doctors' picket lines, ,1123,uk,2023-04-14T12:45:22.000Z,https://www.bbc.com/news/uk-65244747
Rob Burrow receives ‘Points of Light’ award from Rishi Sunak, ,1123,uk,2023-04-14T12:45:22.000Z,https://www.bbc.com/news/uk-64876195
Boy recreates his gran's 1955 photos to help her with Alzheimer's, ,1123,uk,2023-04-14T12:45:22.000Z,https://www.bbc.com/news/uk-england-london-64660582
Tory v Tory: Badenoch and Nokes in menopause debate, ,1123,uk,2023-04-14T12:45:22.000Z,https://www.bbc.com/news/uk-politics-64814500
First toddler receives life-saving gene therapy on NHS, ,1123,health,2023-04-14T12:45:22.000Z,https://www.bbc.com/news/health-64643769
