Title,Content,Number of Words,Category,Date Published,Link
Mysterious dark matter mapped in finest detail yet," It's being described as the most detailed ever map of the influence of dark matter through cosmic history. A telescope in Chile has traced the distribution of this mysterious stuff on a quarter of the sky and across almost 14 billion years of time. The result is once again a spectacular confirmation of Einstein's ideas. Although dark matter makes up about 85% of all mass in the Universe, it's extremely difficult to detect and defies a ready description. But dark matter influences the large scale structure of everything we see - where all the galaxies are, where the voids in space are. It's the scaffolding on which the visible structure of the Universe is hung. It neither emits nor absorbs light. The only way you can very obviously infer its presence is through its interplay with gravity. Big rotating galaxies of stars would fly apart were it not for the inclusion of some unseen mass pulling on them and keeping them intact. But dark matter will bend, or lens, background light, and this is how its whereabouts was mapped by the Atacama Cosmology Telescope (ACT). The Chile facility observed the Cosmic Microwave Background, or CMB - a pervasive but faint glow of long-wavelength radiation that comes to us from the very edge of the observable Universe. ACT mapped the subtle distortions in this ancient light that were introduced as it passed by all intervening matter. You can liken it to the way light is bent as it passes through the bulges and bumps in an old glass window pane. If you know what you're looking at outside, you can use the distortions to say something about the glass. In the same way, the CMB can be decoded to reveal all intervening structure on its journey to us. There have been ""gravitational lensing"" detections similar to this in the past, most notably by the European Space Agency's Planck observatory a decade ago. But ACT surpasses all in terms of resolution and sensitivity. Successive experiments indicate the cosmic contents include: The Universe is calculated to be 13.8 billion years old In the image at the top of this page, the coloured areas are the portions of the sky studied by the telescope. Orange regions show where there is more mass, or matter, along the line of sight; purple where there is less. Typical features are hundreds of millions of light-years across. The grey/white areas show where contaminating light from dust in our Milky Way galaxy has obscured a deeper view. The distribution of matter agrees very well with scientific predictions. ACT observations indicate that the ""lumpiness"" of the Universe and the rate at which it has been expanding after 14 billion years of evolution are just what you'd expect from the standard model of cosmology, which has Einstein's theory of gravity (general relativity) at its foundation. Recent measurements that used an alternative background light, one emitted from stars in galaxies rather than the CMB, had suggested the Universe lacked sufficient lumpiness. ""It's one of the 'cosmic tensions' we all talk about,"" said Prof Jo Dunkley from Princeton University, US. ""But with this new result, we find exactly the right amount of lumpiness - no tension! So, if there is a tension, it is something that appears in the galaxy data - not in ours,"" she told BBC News. Another tension concerns the rate at which the Universe is expanding - a number called the Hubble constant. When Planck looked at temperature fluctuations across the CMB, it determined the rate to be about 67 kilometres per second per megaparsec (A megaparsec is 3.26 million light-years). Or put another way - the expansion increases by 67km per second for every 3.26 million light-years we look further out into space. A tension arises because measurements of the expansion in the nearby Universe, made using the recession from us of variable stars, clocks in at about 73km/s per megaparsec. It's a difference that can't easily be explained. ACT, employing its lensing technique to nail down the expansion rate, outputs a number similar to Planck's. ""It's very close - about  68km/s per megaparsec,"" said Dr Mathew Madhavacheril from the the University of Pennsylvania. ACT team-member Prof Blake Sherwin from Cambridge University, UK, added: ""We and Planck and several other probes are coming in on the lower side. Obviously, you could have a scenario where both the measurements are right and there's some new physics that explains the discrepancy. But we're using independent techniques, and I think we're now starting to close the loophole where we could all be riding this new physics and one of the measurements has to be wrong."" Papers describing the new results have been submitted to The Astrophysical Journal and posted on the ACT website. The telescope, which worked from 2007 to 2022 before being dismantled, was funded by the US National Science Foundation. The scientific collaboration has yet to finish analysing all its data. ",822,science,2023-04-11T17:03:43.000Z,https://www.bbc.com/news/science-environment-65243132
Nasa names first woman and black man on Moon mission," The US space agency Nasa has named the four astronauts who will take humanity back to the Moon, after a 50-year gap. Christina Koch will become the first woman astronaut ever assigned to a lunar mission, while Victor Glover will be the first black astronaut on one. They will join Reid Wiseman and Jeremy Hansen to fly a capsule around the Moon late next year or early in 2025. The astronauts won't land on the Moon, but their mission will pave the way for a touchdown by a subsequent crew. The three US citizens and one Canadian were presented to the public in a ceremony in Houston, Texas. They will now begin a period of intense training to get themselves ready. In selecting a woman and a person of colour, Nasa is keeping its promise to bring greater diversity to its exploration efforts. All the previous crewed missions to the Moon were made by white men. Reid Wiseman (47): A US Navy pilot who served for a time as the head of Nasa's astronaut office. He's flown one previous space mission, to the International Space station in 2015. Victor Glover (46): A US Navy test pilot. He joined Nasa in 2013 and made his first spaceflight in 2020. He was the first African American to stay on the space station for an extended period of six months. Christina Koch (44): An electrical engineer. She holds the record for longest continuous time in space by a woman, of 328 days. With Nasa astronaut Jessica Meir she participated in the first all-female spacewalk in October 2019. Jeremy Hansen (47): Before joining the Canadian Space Agency, he was a fighter pilot with the Royal Canadian Air Force. He has yet to fly in space. ""The Artemis-2 crew represents thousands of people working tirelessly to bring us to the stars. This is their crew, this is our crew, this is humanity's crew,"" said Nasa Administrator Bill Nelson. ""Nasa astronauts Reid Wiseman, Victor Glover, and Christina Hammock Koch, and CSA astronaut Jeremy Hansen, each has their own story, but, together, they represent our creed: E pluribus unum - out of many, one. Together, we are ushering in a new era of exploration for a new generation of star sailors and dreamers - the Artemis Generation."" Wiseman will be the commander; Glover will be his pilot; Koch and Hansen will act as the supporting ""mission specialists"". The quartet are essentially repeating the 1968 mission carried out by Apollo 8, which was the first human spaceflight to reach the Moon. Its crew took the famous ""Earthrise"" picture that showed our home planet emerging from behind the lunar horizon. The major difference this time will be the use of the 21st Century technology that Nasa has developed under its Artemis programme. In Greek mythology, Artemis was the twin sister of Apollo. Last year, the agency tested its next-generation Moon rocket, called the Space Launch System, and its associated crew capsule, known as Orion. This Artemis-1 mission left Earth on a 25-day excursion around the Moon without anyone on board. This allowed engineers to assess the readiness of the hardware. Now, the newly named astronauts will climb into Orion for Artemis-2 and a journey to and from the Moon that's likely to take about 10 days. The last human spaceflight mission to the Moon was Apollo 17 in December 1972. The first landing was Apollo 11 in 1969. Artemis-3, the first landing of the new era, is not expected to occur until at least 12 months after Artemis-2. Nasa doesn't yet have a system capable of taking astronauts down to the lunar surface. This is being developed by entrepreneur Elon Musk's SpaceX company. It will be a variant of his Starship vehicle, which is due to start flight testing in the next few weeks. ""We need to celebrate this moment in human history because Artemis-2 is more than a mission to the Moon and back; it's more than a mission that has to happen before we send people to the surface of the Moon. It is the next step on the journey that gets humanity to Mars,"" Victor Glover told the Houston ceremony. Christina Koch added: ""Are you excited? I asked that because the one thing I'm most excited about is that we are going to carry your excitement, your aspirations, your dreams with us, on this mission, Artemis-2 - your mission."" Vanessa Wyche is the director of Nasa's Johnson Space Flight Center, the home of mission control. She said: ""Among the [Artemis-2] crew are the first woman, first person of colour, and first Canadian on a lunar mission, and all four astronauts will represent the best of humanity as they explore for the benefit of all."" ",788,science,2023-04-03T15:28:30.000Z,https://www.bbc.com/news/science-environment-65165845
Hero's return for astronaut Shaun the Sheep," It was a giant leap for lamb-kind, but now he's baa-ck. Shaun the Sheep has returned to Britain after taking part in the US space agency's (Nasa) epic mission to the Moon last year. A model of the animated movie character was a passenger in the capsule that was blasted into orbit by the world's most powerful operational rocket. Shaun covered almost 1.5 million miles on his lunar travels before splashing down in the Pacific Ocean. The 16cm-tall stop-motion model was strapped in for the ride. He earned his astronaut wings as the mascot on the mission for the European Space Agency (Esa). The agency had provided the propulsion module that pushed the Nasa capsule along on its 25-day journey. Wednesday saw Dr David Parker, the agency's director of exploration, visit Aardman studios in Bristol, where all of Shaun's TV programmes and films are produced. ""It is always a special pleasure to greet European astronauts when they return from space, and today I am delighted to welcome Shaun the Sheep, alive and wool after a well-deserved rest on the farm,"" he said, tongue firmly in cheek. ""As the first sheep to fly to the Moon and back, he's got a lot to teach us about the ambition, talent and diversity needed for Europe's exploration of space."" Dr Parker unveiled Shaun's official Esa astronaut photo, and presented Aardman with a certificate from Nasa. Accompanying the Esa executive was the UK's newest human astronaut candidate, Dr Rosemary Coogan. The astrophysicist was selected in November to join the agency's astronaut corps and will begin formal training next month. Europeans will fly with their American colleagues on follow-up missions to the Moon later this decade. Dr Coogan could therefore emulate Britain's most famous sheep. ""I think Shaun going to space has been an incredible way to engage the public,"" she told BBC News. ""It's an absolute thrill to think about following in Shaun's footsteps, going around the Moon and getting involved with all of Nasa's missions. It would be an absolute pleasure to do that, and we'll see what the future holds."" Shaun has become one of Aardman's most popular characters. His TV series is currently broadcast in 170 territories around the world and his Facebook page has over 5.5 million followers. Hannah Brooks is one of his animators. In classic stop-motion style, she moves Shaun's silicone body parts, little by little, taking a photo at every step to build up the action. It's a slow process. A day's work in the studio will produce only a few seconds of storyline. ""He's such a cute, cheeky little character,"" said Hannah. ""I can only imagine he would love to have such a big adventure. It's always what he's trying to do in all of his little episodes. He's a bit too naughty, but he has the need to go explore."" Shaun's habit of getting into various scrapes on his home farm, Mossy Bottom, probably convinced Nasa he had to be strapped in at all times. Only the American agency's mascot - a toy Snoopy the Dog - was allowed to float free around the cabin. Esa's tie up with Aardman began with publicity around the studio's release of a Shaun the Sheep sci-fi movie, Farmageddon, in 2019. Aardman co-founder Peter Lord was shocked when the agency suggested Shaun go on a real space mission. ""I virtually couldn't believe it. It seemed incredible,"" he told BBC News. ""It's every child's dream, isn't it, to be an astronaut? And so the fact that he was doing it for us seemed very, very important. Extraordinary. Our baby, our creation."" Nasa's project to return people to the Moon is called Artemis (or as Shaun likes to call it: ""Baa-rtemis""). The next mission is scheduled to occur at the end of next year. Four human astronauts will fly around the Moon. Aardman hopes its little sheep will once again be in the capsule. ",653,science,2023-03-29T11:01:26.000Z,https://www.bbc.com/news/science-environment-65107594
Virgin Orbit boss blasts leaders in parting email," A senior executive at Virgin Orbit has hit out at the leadership in a farewell email, telling staff at the bankrupt rocket firm they ""deserved better"". Chief operating officer Tony Gingiss issued a lengthy apology to workers while blasting his fellow managers for apparently failing to say sorry. Virgin Orbit filed for bankruptcy after failing to raise more funding. Earlier this year, it failed to complete its first-ever satellite launch from UK soil. In his goodbye email, Mr Gingiss thanked workers for ""everything you gave to me personally"", adding ""you deserved better than this!"". He continued: ""You simply did not have the leadership or opportunity to demonstrate to the world what you can fully do and how this product could be an enduring force in the market."" He appeared to directly criticise Virgin Orbit's chief executive Dan Hart by later stating he wanted to ""say something to you, that you have not heard from the person who should be saying it, so I will…I'm sorry and I apologize"". ""I'm sorry that I was not able to convince our leader and board to take a different path to give us more time to figure things out,"" he said in the email, which was published in full by US network CNBC. Virgin Orbit has not responded to the BBC's request for comment. The company, based in California, was founded in 2017 and is a spin-off from Sir Richard Branson's space tourism company Virgin Galactic. It launches rockets from beneath modified Boeing 747 planes to send satellites into space. But in January, an attempt to send a satellite into orbit from Spaceport Cornwall for the first time failed because a rocket fuel filter had become dislodged, causing one of the engines to overheat. Since then financial troubles at the firm have emerged and attempts to get new investment have also ended in failure. Prior to filing for bankruptcy, the business, which is mostly owned by Virgin Group, announced last week that it would cut 85% of its 750-strong workforce. On Tuesday, Virgin Orbit's boss Mr Hart said that although the company had ""taken great efforts"" to address its finances and secure more funding, ""we ultimately must do what is best for the business."" He said that Virgin Orbit would now concentrate on finding a buyer for the business ""to provide clarity on the future of the company to its customers, vendors, and employees"". The company had debts of $153.5m (£123m) as of September last year. On Tuesday, the company said Virgin Investments, part of Virgin Group, would provide $31.6m in new money to help Virgin Orbit through the process of finding a buyer. It has filed for what is known as Chapter 11 bankruptcy protection in the US. This allows a business to keep operating and address its financial issues while providing protection against creditors who are owed money. Former president of Virgin Galactic Will Whitehorn said the failed launch in Cornwall and the collapse of Silicon Valley Bank in the US at the time it was trying to raise new funding contributed to its downfall. But Mr Whitehorn said the business deserved a second chance because there was ""a lot of demand"" in the industry. Sir Richard is one of a very small group of billionaires who have in recent years expanded their business empires into launching satellites and attempts to pioneer commercial space travel. The others include Jeff Bezos, founder of online retailer Amazon, who set up his space company Blue Origin, as well as Twitter and Tesla owner Elon Musk, who founded SpaceX. ",593,business,2023-04-05T09:19:21.000Z,https://www.bbc.com/news/business-65186172
Facebook $725m settlement fund opens to US claims," US Facebook users can now apply for their share of a $725m (£583m) privacy-case settlement. The legal action alleged the social-media company shared 87 million users' data without their consent, via third parties such as Cambridge Analytica. The allegation, dating back to 2018, remains one of the highest-profile data-privacy scandals. Meta, which owns Facebook, has denied any wrongdoing but agreed to the settlement. Anyone who used Facebook in the US between 24 May 2007 to 22 December 2022 can claim - ""in the range of 250-280 million"" people, according to the ruling document. Claims can be filed on the settlement website or by mail, including: Claimants can choose to receive their funds via: The deadline to claim is 25 August - but anyone wanting to object to the settlement or retain their right to take separate legal action against Meta by opting out must do so by 26 July. Claimants who qualify will be awarded one point for each month they had a Facebook account during the ""class period"". The net settlement amount ($725m minus legal and administrative costs) will then be divided by the total number of points, to determine how much money will be paid for each. A federal judge gave the agreement preliminary approval at the end of March - but a final approval hearing is set for 7 September and there may be appeals that delay the process further. Technology author James Ball told BBC News that Meta executives would be relatively pleased with this settlement. ""On one level, $725m is a huge amount of cash - but Meta is such a large company that this figure represents less than three days of its revenue,"" he said. ""Meta is keen to present privacy issues such as those raised by the Cambridge Analytica controversy as historical - obviously it remains to be seen whether that's the case - as if there are more settlements in the future, that could start to have a more serious impact on the company."" ",332,technology,2023-04-20T17:21:26.000Z,https://www.bbc.com/news/technology-65338916
Facebook still being used to arrange fake reviews - Which?," Facebook is still being used by people arranging fake five-star reviews for products, consumer group Which? has said. It found 14 groups centred around trading reviews for cash or free products - including earbuds, fitness watches and a solar-powered sprinkler. Which? first reported on such groups in 2018 - and the government is preparing legislation to tackle the problem. Facebook said it was investing in new technologies to weed out fake reviews. ""Fraudulent and deceptive activity is not allowed on our platforms, including offering or trading fake reviews,"" said an official from Meta, which owns Facebook. ""We've removed the groups shared with us, for violating our policies."" The Competition and Markets Authority investigated Amazon and Google over concerns fake five-star reviews could be misleading shoppers in 2021. Then, in April 2022, the government proposed new rules, including making it ""clearly illegal"" to pay someone to write or host fake reviews. It says the average UK household spends about £900 each year after being influenced by online reviews. The new rules are expected to form part of the Digital Markets, Competition and Consumer Bill, due to be published in the coming weeks. Which? said researchers had found 14 Facebook groups offering cash or products in exchange for reviews on Amazon, Google or Trustpilot. In total, there were more than 62,000 members across the groups. When a researcher had contacted a member of one of the most popular groups and told them they liked some of the products shared there, Which? said, they had been told to buy one of the products and they would be refunded if they gave it a five-star review. ""Despite previous interventions by the regulator, our latest findings suggest an industry dedicated to fake-review trading continues to thrive on Facebook,"" Which? policy and advocacy director Rocio Concha said. ""[It leaves] consumers exposed to misleading information on some of the world's biggest review and shopping platforms."" Amazon has long combated fake reviews on its platform and, in July, took legal action against the administrators of more than 10,000 Facebook groups. An Amazon official said ""in the last few weeks"" it had launched further legal action against more than 20 websites dealing in fake reviews. ""By taking this action against fraudsters, we are going after the source of the problem and shutting down these fake-review businesses,"" they said. ",389,technology,2023-04-21T05:34:28.000Z,https://www.bbc.com/news/technology-65336369
Elon Musk threatens to sue Microsoft over Twitter data," Twitter boss Elon Musk has threatened to sue Microsoft as he accused the technology giant of using data from his social media company without permission. ""They trained illegally using Twitter data. Lawsuit time,"" the multi-billionaire said in a tweet. Mr Musk was responding to Microsoft's plan to remove Twitter from its corporate advertising platform. He did not provide further details or evidence to support the claim. Microsoft declined to comment when approached by the BBC on Thursday. Earlier, the company said in a notice that its advertising platform would ""no longer support Twitter"" from Tuesday 25 April. As a result, ad buyers would not be able to access their Twitter accounts through Microsoft's social management tool. ""Other social media channels such as Facebook, Instagram, and LinkedIn will continue to be available,"" Microsoft said. Twitter's press email responded to a query with a customary poo emoji. In a separate tweet, in the discussion about the social media platform's data, Mr Musk said he was ""open to ideas"". ""But ripping off the Twitter database, demonetizing it (removing ads) and then selling our data to others isn't a winning solution,"" he added. In February, Twitter started charging for the data it collects from ""hundreds of millions"" of users, with a basic plan starting at $100 a month. The data allows users to ""manage and track every aspect of your social media presence"", according to the platform. Since buying Twitter for $44bn (£35.4bn) in October, Mr Musk has cut its workforce by around 80% and moved to boost the company's finances through measures including charging users for ""blue tick"" verification. In recent months, major companies including iPhone maker Apple reportedly halted advertising on the platform over concerns about how content was moderated on the site. In November, Mr Musk said Twitter had seen a ""massive"" drop in revenue and blamed activists for pressuring advertisers. Speaking to the BBC last week, he said Twitter had just months left to live when he took over. He also said ""almost all advertisers have come back or said they are going to come back"" to Twitter. Mr Musk added that Twitter could be profitable by the second quarter of 2023, and he would be willing to sell the company if the right person came along. ",377,business,2023-04-20T04:06:19.000Z,https://www.bbc.com/news/business-65332207
