Title,Content,Number of Words,Category,Date Published,Link
"Sudan fighting: Civilians in untenable situation, Red Cross says"," People are making desperate attempts to flee Sudan after more than a week of fighting there, the Red Cross says. The situation was now ""untenable"" for civilians left without food or water, and some hospitals had stopped working, spokeswoman Alyona Synenko said. Convoys leaving the capital Khartoum had encountered robbery and looting, US Secretary of State Antony Blinken said. People getting out of Khartoum spoke of corpses left lying on the street. ""We saw bodies everywhere - there's no security whatsoever so nobody dares go collect them - but there's utter destruction too. Everything is just devastated,"" Italian NGO boss Stefano Rebora told the BBC. South African diplomat Clayson Monyela said all routes out of Khartoum - a city of six million people - were ""risky and dangerous"". ""The airport remains closed, the fighting continues,"" he told the BBC. He reiterated a call for a ceasefire to allow people to leave, and aid to enter. Sudan was suffering an ""internet blackout"" with connectivity at 2% of ordinary levels, monitoring group NetBlocks said on Monday. In Khartoum, the internet has been down since Sunday night. Meanwhile, water and electricity have been restored to some parts of the capital, but not all of them. One Nigerian student told the BBC: ""The taps are outside in the street and that's the scary part - sometimes we are going out to get water but there is shooting or explosions going on, so we just have to run there and get the water and come back."" Numerous countries have evacuated their civilians - and thousands of other people have made risky escapes. Many of those who have left Khartoum have headed to other parts of the country where they have family ties - leaving parts of the city centre completely deserted. Others have gone north to Egypt by bus, or headed south. Officials in neighbouring South Sudan said the roughly 10,000 refugees who had arrived in recent days came from Eritrea, Kenya and Uganda - as well as from Sudan and South Sudan themselves. Multiple countries have stepped up efforts to evacuate diplomats and civilians from Khartoum. By Monday about 1,100 European Union citizens had been taken out of Sudan, an EU diplomatic source told the BBC. The bloc believed about 1,700 EU citizens had been in Sudan when the fighting began. The US said it had airlifted fewer than 100 people by helicopter on Sunday in a ""fast and clean"" operation. The American embassy in Khartoum is now closed, and a tweet on its official feed says it is not safe for the government to evacuate private US citizens. The UK government airlifted British diplomats and their families out of the country. Foreign Minister James Cleverly said options to evacuate remaining Britons were ""severely limited"". Canada has evacuated its diplomatic staff. Turkey - a key player in Sudan - began evacuation efforts by road from the southern city of Wad Medani on Sunday, but plans from one site in Khartoum were postponed after a nearby explosion. More than 150 people - mostly citizens of Gulf countries, as well as Egypt, Pakistan and Canada - were evacuated by sea to Saudi Arabia. Long lines of UN vehicles and buses were seen leaving Khartoum on Sunday, heading east towards Port Sudan on the Red Sea and carrying ""citizens from all over the world"", a Sierra Leonean evacuee told AFP news agency. However many foreign students from Africa, Asia and the Middle East are among the foreigners still trapped in Khartoum. The western region of Darfur - where the RSF first emerged - has also been badly affected by the fighting. The UN has warned that up to 20,000 people - mostly women and children - have fled Sudan to seek safety in Chad, across the border from Darfur. However in other parts of the country, some semblance of normalcy has emerged. In Omdurman, across the Nile from Khartoum, there has been less gunfire and explosions than in previous days, possibly to allow civilians to leave. Heavy fighting outside the army headquarters has stopped. As a result, for the first time since hostilities broke out more than a week ago, women and children have been out on the streets, visiting neighbours and going to markets, which still have some basic supplies such as oil and wheat. There are long queues outside the few bakeries that remain open. More than 400 people have died in the conflict, and thousands have been injured, according to the latest tally from the World Health Organization. But it is feared the true toll is much higher. Several ceasefires that seemed to have been agreed were subsequently ignored - including a three-day pause to mark the Muslim holiday of Eid al-Fitr, which started on Friday. The UN's World Food Programme says the fighting could plunge millions more Sudanese into hunger in a country where a third of the population already struggles to get enough to eat. ",823,world,2023-04-24T15:22:49.000Z,https://www.bbc.com/news/world-africa-65373644
Jerusalem: Five injured in Palestinian car ramming attack," Five people have been injured in a car-ramming attack by a Palestinian in central Jerusalem, Israeli police say. The vehicle hit pedestrians near the busy Machane Yehuda market. The attacker was shot and killed at the scene by a civilian. Police say the assailant was a 39-year-old man from occupied East Jerusalem. It came as Israel began to mark Memorial Day for fallen soldiers and victims of attacks - one of the most solemn days in the national calendar. Speaking at a Memorial Day event, Israeli Prime Minister Benjamin Netanyahu said the attack was ""another attempt to murder Israeli citizens"". ""These terrorist attacks come with the expectation that they will overcome us and will uproot us from here, and if they could, they would murder us all. But they will not overcome us; we will overcome them."" Footage from the scene just moments after the incident shows a dark-coloured Chevrolet hatchback, its front crumpled and windscreen cracked, at a standstill on a zebra crossing between Kiah Street and Agrippas Street. A man in a dark blue T-shirt and black jeans is seen slumped over the bonnet, not moving, as police and civilians mill around. Israel was on heightened alert ahead of Memorial Day, which commemorates soldiers and civilians who have been killed in conflict and attacks since 1860. The sombre occasion leads into Independence Day on Tuesday night and Wednesday. The day is celebrated with patriotic events, with this year marking Israel's 75th anniversary. Palestinians, however, consider Israel's formation in 1948 as a catastrophe which led to the displacement of up to 750,000 of their people in the Arab-Israeli war that followed. Monday's attack comes amid a surge in Israeli-Palestinian violence this year. In the early hours of Monday, a 20-year-old Palestinian was shot and killed during an Israeli army arrest raid in a refugee camp near the city of Jericho, in the occupied West Bank, the Palestinian health ministry said. Since the start of this year, more than 90 Palestinians - militants and civilians - have been killed by Israeli forces. Eighteen Israelis, a Ukrainian and an Italian - all civilians, except for an Israeli paramilitary police officer - have been also killed in attacks by (or suspected to have been carried out by) Palestinians and, in one case, an Israeli Arab. ",383,world,2023-04-24T16:27:14.000Z,https://www.bbc.com/news/world-middle-east-65374749
Sebastien Bellin: Brussels bomb survivor on Ironman feat and forgiveness, ,383,,2023-04-24T16:27:14.000Z,https://www.bbc.com/sport/triathlon/65351405
Disneyland fire-breathing dragon engulfed by flames, ,383,world,2023-04-24T16:27:14.000Z,https://www.bbc.com/news/world-us-canada-65370124
James Cleverly: British diplomats evacuated after specific threats in Sudan, ,383,uk,2023-04-24T16:27:14.000Z,https://www.bbc.com/news/uk-65364960
Ryan Reynolds gatecrashes post-match presser for player's shirt, ,383,uk,2023-04-24T16:27:14.000Z,https://www.bbc.com/news/uk-wales-65364704
Dame Edna's funniest moments in 80 seconds, ,383,entertainment,2023-04-24T16:27:14.000Z,https://www.bbc.com/news/entertainment-arts-65358301
Eid al-Fitr: UAE astronaut sends Eid greeting from space, ,383,,2023-04-24T16:27:14.000Z,https://www.bbc.com/news/65356486
ChatGPT: How generative AI could change hiring as we know it, ,383,20230419,2023-04-24T16:27:14.000Z,https://www.bbc.com/worklife/article/20230419-chatgpt-how-generative-ai-could-change-hiring-as-we-know-it
"Rio de Janeiro: The ""Marvellous City"" welcomes digital nomads", ,383,20230424,2023-04-24T16:27:14.000Z,https://www.bbc.com/travel/article/20230424-why-rio-is-luring-digital-nomads
"Polite Society review: This explosive, action-packed delight recalls Scott Pilgrim, Kill Bill, Get Out and The Matrix", ,383,20230424,2023-04-24T16:27:14.000Z,https://www.bbc.com/culture/article/20230424-polite-society-review-action-comedy-get-out-the-matrix
Why some people wake up unable to move, ,383,20230420,2023-04-24T16:27:14.000Z,https://www.bbc.com/future/article/20230420-the-nightmares-that-paralyse-you-in-your-sleep
Hustle culture: Is this the end of rise-and-grind?, ,383,20230417,2023-04-24T16:27:14.000Z,https://www.bbc.com/worklife/article/20230417-hustle-culture-is-this-the-end-of-rise-and-grind
Why Cornwall is resurrecting its indigenous language, ,383,20230423,2023-04-24T16:27:14.000Z,https://www.bbc.com/travel/article/20230423-why-cornwall-is-resurrecting-its-indigenous-language
Beyoncé and Ronaldo among those to lose Twitter blue check in purge," What do Beyoncé and Cristiano Ronaldo have in common? As of today, they are no longer verified on Twitter. The social media giant began removing the once-coveted blue tick verification from thousands of accounts on Thursday. The move comes as owner Elon Musk attempts to overhaul the social media company to turn a profit. Users who wish to retain the check beside their name must pay $84 a year (£67) to subscribe to Twitter Blue. As some lost their ticks, others kept them. Despite saying he would not pay to be verified, LeBron James still has a blue tick which is a ""complimentary subscription"" gifted by Elon Musk. The billionaire confirmed Stephen King and William Shatner also got the same deal. As the change happened, many formerly verified took to Twitter to joke about it, or mourn the loss. US Olympian Lolo Jones noted she's still verified where it counts: her dating profile. Other users noted the irony that actor Jason Sudeikis had lost his verification, while Ted Lasso, the fictional character he portrays, had not. US rapper Ice T joked that the uproar over the checks was unnecessary. ""The fact that we're even discussing Blue check marks is a Sad moment in society,"" he posted. The company first introduced the verification feature in 2009, after a former professional baseball player sued the social media giant over imposter accounts. The blue check became a status symbol and a sign of authority. But in the new Twitter-verse, Mr Musk wants users to pay to be verified. The decision to monetise verification could usher in a massive cultural and power shift on the platform. In the days before verification, Kanye West, Shaq and Ewan McGregor were among the first celebrities to  speak out about being impersonated on Twitter. Now that the badges are gone, a celebrity's follower count may become the only way to tell the difference between someone famous and an imposter. Within a few hours of losing verification, an account posing as Hillary Clinton, complete with the same profile picture as the former US senator, ""announced"" she would again run for the presidency. Under Twitter's new verification scheme, gold, grey and blue badges are meant to provide more context to how an account was verified. But the lack of verification is already causing confusion. In New York City, a new handle has claimed to be the ""authentic Twitter account"" representing the government. Experts warn these are the kind of tweets that could lead to the spread of misinformation. Mr Musk has tried to frame the decision to do away with verification as a way to democratise content on the site. But critics have argued the move will amplify disinformation as Twitter Blue subscribers will get prioritised rankings - Mr Musk has said that only verified accounts will appear in the site's prominent For You stream. Social media monitors and experts fear the rise in paid verification will lead to an amplification of misinformation on the site. If that were to happen, it could scare off yet more advertisers - and undermine any extra revenue Twitter is getting from its verification subscription model. But Mr Musk said pain is a part of change. ""I feel like we're headed to a good place,"" he told BBC News. ""Overall, I think the trend is very good."" Additional reporting by Shiona McCallum. ",558,technology,2023-04-20T23:31:22.000Z,https://www.bbc.com/news/technology-65344010
Buzzfeed News to close as media firm cuts jobs," Buzzfeed is to close its news site and cut its workforce by 15%, chief executive Jonah Peretti has said. It comes as the digital media company faces serious financial challenges, including a slump in advertising spending. Calling the decisions ""deeply painful"", Mr Peretti said he could not invest more in the unprofitable news site. He said the firm would focus on delivering news via the HuffPost, which Buzzfeed took over two years ago. ""Our industry is hurting and ready to be reborn,"" he said in a memo to staff. ""We are taking great pains today, and will begin to fight our way to a bright future."" Founded in 2006, Buzzfeed was once one of the trendiest names in online media, known for its quizzes and viral content, as well as a serious news operation. But the firm, which employed more than 1,300 people globally at the end of last year, has shifted away from news, as bringing in ad revenue and audiences became more difficult and other lines of business, such as producing custom content, grew more quickly. It listed on the stock exchange in 2021, but raised far less money than it had hoped. ""While layoffs are occurring across nearly every division, we've determined that the company can no longer continue to fund BuzzFeed News as a standalone organization,"" Mr Peretti wrote to staff. Many other advertising-reliant companies, including media firms and tech giants such as Facebook's owner Meta, have been making job cuts in recent months, while investors have been forced to reassess the values of upstart news ventures such as Vice News and Vox Media. News company Insider also revealed plans on Thursday to reduce its workforce by 10% or about 95 jobs. Mr Peretti said his company, which will continue to operate HuffPost, its food brand Tasty, Complex Networks, and its namesake website, had faced wider challenges but he also blamed himself. He said he had been ""slow to accept"" the difficulties of making money from online news with distribution dominated by big tech platforms. The firm should have generated more revenue after acquiring Complex in 2021, which runs the music site Complex and other brands, he added. ""I could have managed these changes better as the CEO of this company and our leadership team could have performed better despite these circumstances."" he said. In her own memo to staff, parts of which she shared on social media, Buzzfeed News editor-in-chief Karolina Waclawiak said the company should have tried to build a business around its news site earlier, describing the closure as ""avoidable"". She said the failure was indicative of a wider crisis in journalism and she feared the results if subscription-based news models were the only ones that survive. ""The implication is that only people who can afford to pay for it will have access to high quality information while everyone else will need to parse through the rampant misinformation that is widely shared across social platforms,"" she wrote. ""The consequences of this are dire."" Buzzfeed had already announced several rounds of layoffs in recent years, including one in December that affected roughly 170 people or 12% of staff. The latest cuts involve about 180 jobs. Buzzfeed said it expected to incur $7m (£5.6m) - $11m (£8.8m) in severance and other charges connected to the move. Some of the news staff may find roles in other parts of the firm, the company said. Shares fell 20% on Thursday on the news, reducing Buzzfeed's market value to about $100m (£80m) - a fraction of the more than $1.5bn (£1.2bn) valuation investors were reportedly discussing just two years ago. ",602,,2023-04-20T18:35:36.000Z,https://www.bbc.com/news/65341450
The tech entrepreneur betting he can get younger," Our ultimate demise is inevitable, but a growing number of experts believe how we feel in our later years may not be. They talk of ""healthspans"" - the number of healthy years of our lives. Life expectancy may have doubled over the last 150 years, but many of us have seen the undignified and devastating decline of our loved ones as they aged. To avoid that fate a new industry is emerging, promising a longevity revolution with techniques they say lead to healthier, longer lives. Business is booming for those in this space, with supplements being touted as having the ability to battle our cellular decline, and all sorts of hot and cold therapies trying to help us reduce inflammation and disease risk in our bodies. So I set out on a trip to the centre of it all, California, unsure as to whether I was arriving at the heart of a money-spinning cult, or the next frontier of medicine. Tech entrepreneur Bryan Johnson is spending millions a year trying to reduce his biological age - how old his body seems, rather than his actual chronological age, which is 45. There's a good reason for any of us to do this. Age is the highest risk factor for disease, whether it's cancer, type 2 diabetes, heart disease, or dementia, so if ageing as a whole could be delayed, then so could the risk of onset of these conditions. For him though, it's a sport. In Mr Johnson's luxurious Venice Beach home, a bedroom has been converted into a clinic where he spends many hours. He wakes at 5am, eating his first meal an hour later, followed by a second, and final one at 11am. This, combined with a forensically selected 54 pills, a mix of supplements and off-label medication, are all planned based on readings from a catalogue of tests. His days consist of a torturous exercise regime, monitoring and numerous treatments. He told me the all-over skin laser treatment he's been having has reduced his skin age by 22 years, the greatest age reduction in any part of his body. The aesthetics are just a small part of it all though, as he reminds me ""our skin is our biggest organ"". Mr Johnson was warm, logical and likeable. I left his house wanting to be (a bit) like him. Maybe I am already - I run 5km a day, try to avoid sugar, and test extreme tracking devices for fun. My colleagues considered Mr Johnson's existence joyless, so his life is clearly not for everyone. While his routine might seem extreme, every conversation I had still came back to lifestyle. ""Lifestyle is responsible for about 93% of your longevity - only about 7% is genetics,"" says Eric Verdin, chief executive of The Buck Institute for Ageing Research. ""Based on the data [if we live healthily], I would predict that most people could live to 95 in good health. So there's 15 to 17 [extra] years of healthy life that is up for grabs for all of us,"" he told me. The big question, which Mr Verdin and others are investigating, is what does a healthy lifestyle mean? Take exercise for example - should that be a daily stroll, or a HIIT class? The same goes for healthy eating. Is fasting as important as avoiding sugar? And what about a good night's sleep? You can't underestimate the obsession with sleep I came across. I met many people setting their alarms not to wake up in the morning, but to remind them to go to bed on time for a full eight hours. Well, we all set the bar at different levels. Mr Verdin practises what he preaches, his regime consisting of ""a whole lot of exercise, some fasting, good sleep, lots of social connections, very little alcohol"". His suggestion for others? ""Try to spend at least 14 hours of your 24 hours without ingesting any calories as this has a profound effect on your metabolism."" The jury is out on how healthy this is for some women though. Keeping better track of our bodies as they age might help. Health risks could be flagged in advance and any new drugs could be applied just at the right time. Make it personalised, make it pre-emptive, make it better is the mantra. It was interesting to see that pretty much all of those working in longevity science wear more than one tracker themselves - commonly a smartwatch and a smart ring (way more convenient for sleep I can tell you - and these people are obsessed with prioritising sleep). More technology of business: For my part I've found health tracking illuminating. I am not diabetic, but have been fascinated by the findings of a continuous glucose monitor I wore for a while. The assumption is progress on longevity will come, albeit in a less sensational form than some may be hoping for. Experts suggest that a drug might emerge that will initially make a year or two's difference, then a few years more with the next generation, and so on. But along with such progress will come practical and ethical dilemmas. One fundamental question is whether ageing can be defined as a disease. This might simplify the approval of drugs by regulators, but risks labelling people over a certain age ""diseased"". The cost of such treatments may or may not (for developed medical systems anyway) be an issue, depending on what it turns out to be. Meanwhile, a healthier life is likely to lead to a few extra years of existence, so we may need to work longer. On my longevity learning mission, my expectations were upturned. I'd seen the sensationalist headlines, suggesting tech billionaires lounging on their yachts, deliberating over whether they fancied saving the world, going to space, or ""curing"" ageing. This wasn't the reality I saw. The wealthy have been giving money to medical research for years. This is just a new generation of wealth, and a potential new specialism of medicine. Plus it's really interesting, and affects us all. But right now, extending your healthspan involves hard work. As Silicon Valley-based journalist Danny Fortson put it: ""Exercise is hard, magic pills are easy, so that's why everyone is so excited about the pill."" So I returned home feeling more determined than ever to live my healthiest life - sleep better, exercise without excuse, eat well, cherish social connections (yes, this was on the longevity prescription). With a bit of luck that might buy me enough time to benefit from any scientific breakthroughs. ",1094,business,2023-04-20T23:01:42.000Z,https://www.bbc.com/news/business-65238774
